sentimen,tweet
positif,ketua ada presiden wakil serah gaji rakyat perlu rakyat prabowo
negatif,merdeka dungu otak pakai dasar dismpaikan prabowo ttng ekonomi nyungsep sembako mahal tani susah lpngan kerja sulit debat ngapain bahas game mobile legend pmbawah mudorat anak bangsa tolol
negatif,maaf baoak target tumbah kembang tumbuh ekonomi janji jokowi wujud
netral,coba bicara gin jaman lulung topik fungsi dprd mitra bidang legislatif awas gubernur jalan anggar bayar pajak senang anggota dprd garang
netral,kunci ekonomi rakyat
negatif,dampak ekonomi gimana otak plonga plongo
positif,paguyuban suami suami gaji paspasan ada nuntut beliin hermes jokowi
negatif,pikir kembang esport main aplikasi smartphone mulai manfaat anggur gaji baca buka wawas mpermalukan
positif,salut prabowo sandiuno ambil gaji rupiah amanah presiden rela korban jiwa raga harta nkri sdgkan jabat serakah korupsi besar semangat gerindra fadlizon dahnilanzar
positif,mertua guru honorer abdi gaji ribu ikhlas saking suka profesi anak bungsu rela momong tetangga moga setlh prabowo presiden santun guru honorer
positif,ideologi alam jokowi milik wakil bidang ekonomi coblos ya
netral,pancasila nkri harga mati ganggu gugat
netral,ekonomi salah arah wowo salah presiden presiden jokowi
positif,janji manis pilpres menang bebas gada kendara prabowo sandi larang gaji kerja awam miskin jokowi anggur gaji menang
negatif,overheard ehmm jokowi bagus segi bangun iyaa ekonomi maju ya males pilih bangun rasain bikin jalan mana motor awas mudik ya
positif,prabowo sandiuno pilih presiden gaji ambil serah penting rakyat masya allah
negatif,yernyata gin otak daftarpresidenamerikaserikat harga bahas gerak legend dasar goblock dennysiregar
positif,gaji buta mending lapor prabowo izin allah beliau daftarpresidenamerikaserikat gantiin
netral,janji ambil gaji pilih prabowo sandi ikut jejak presiden kenal
negatif,ambil gaji perusahaanya menguadai proyek sobat golput ya pilih jokowi selamat bangsa
negatif,ning tengar erang harga kacang jepit susu kian tonjol kolor turun jokowi
netral,jokowi gaji plus tunjang dibeliin sembako kaum dhuafa
negatif,gaji pres beli tusuk gigi prabowo
netral,tolong lihat dampak buruk bing manfaat mudharatnya paham benar segi ekonomi
netral,arah ekonomi indonesia salah merdeka prabowo warta ekonomi
positif,poin jokowi khianat bangsa nimbun harta hindar pajak bicara podium ekonomi makro mikro ngeh gebrak teriak bajing elit bajing pasang mandi ya mbulet
netral,debat capres prabowo ekonomi salah arah
negatif,salah perintah hukum ketat contohin tadu kaya singapore perintah gaji tugas perintah tanggung rakyat sanggup pimpin paham makna pimpin
positif,jokowi optimis indonesia masuk ekonomi dunia
netral,ahli ekonomi klrg ya tvonenews kompastv trans
positif,lega tulus suami bini cinta salah alas primer pilih jokowi pilpres pilih apr besok
positif,teman telikung hahahahaha sang jendral langsung aku arah ekonomi bawah jokowi hehehehe
positif,cuaca cerah sambut datang presiden jokowi iriana bandara internasional king khalid riyadh arab saudi minggu april alhamdulillah orang hujat beliau harga dunia
netral,prabowo milik jiwa sportif keliru bijak ekonomi indonesia puluh jokowi kuasa sayang partai koalisi kenan emosi jujur ungkap fakta aneh
negatif,sadar rapat jokowi cerita pasang harga wapres tawar rasa
positif,diladenin siap militan harga bicara blok silent senang pecah beda pilih jaga pancasila
positif,bang sandiuno prabowo tempat tugas bangga prabowo sempat ahli jaga daulat kelola ekonomi aman adil makmur sehat tugas berat pundak
positif,daniel tangkap prabowo salah langkah baik ekonomi nasional salah arah
netral,wowo bilang ekonomi salah jalan salah presiden presiden jokowi
netral,info bilang debat ekonomi indonesia cacat jokowi salah pimpin gemar salah bahwasanya sukangetweet bocahsosmed saaebunglon
positif,pilih pimpin korban wakaf harta bangsa indonesia gaji infak kaum duafa miskin merdeka cari jual beli jabat hobby serang awal
netral,arah bangun ekonomi salah prabowo sandi referendum ekonomi
positif,cebong cebong pidato prabowo salah arah ekonomi goreng koalisi adil makmur negarawan pola pikir maju salah ya baik terus
positif,ambil gaji sedikit presiden yaallah moga rejeki prabowo sandi limpah terus amenamon
netral,lugas jokowi visi misi debat tegas kembali watak asli indonesia fokus ekonomi perata bangun
positif,bahas ekonomi gagas prabowo sandi turun tarif harga kian roket stabil tunggu
positif,kampanye rakyat bantu berhatihati sumbang dana bersusahpayah prabowo sandi insyaallah ganti gaji sumbang potong pajak
negatif,rabu april prediksi jokowi kalah syaa allah sebab utama kalah tumbuh ekonomi hutang trilyun janji
netral,perintah jokowi bangun spbu setelag kabupaten puncak jaya papua harga ribu liter
positif,lihat cuplik debat malam perata ekonomi susu makan anak pagi salut prabowo
negatif,rachlannashidik ekonomi indonesia hancur ulah ya jokowi periode mmbuat rakyat sejahtera ekonomi bobrok prabowo dismpaiknnya penuh semgat
negatif,pimpin jokowi ekonomi btam puruk buruh susah cari kerja
netral,ada tulis media apa media netral ya kuat lemah perintah jokowi bidang ekonomi
netral,pilih pimpin capai capai ekonomi perintah jokowi
netral,beli lalap abang lalap presiden jokowi lalap presiden prabowo harga hati aduh frontal gin apa orang hak pesta demokrasi negeri amat
netral,jokowi warga papua hak rasa harga pulau jawa
negatif,dungu ambil sampel game populer indonesia main hasil uang main akun jual beli anak pakai duit bapak pusing bayar kredit gada nguras gaji
positif,closing prabowo bang sandiuno mantul masya allah beliau dua komitmen menang ambil gaji peser serah kaum dhuafa allahu akbar
netral,prabowo ekonomi indonesia salah arah presiden jokowi kader demokrat koalisi
negatif,bajing tengik sembah lengser jokowi bendahidup dableg fokus ekonomi tahan indonesia mobile legend
negatif,gaji ambil kaya hari bantu dana kampanye
netral,jokowi fokus apbn apbd fokus belanja produktif dorong ekonomi rakyat
negatif,ngerti istilah kolam lihat cina ekonomi maju ekonomi roket nyungsep ideologi istilah ajar negeri cina kolam
positif,jokowi minta tolong hapus denda agun bayar listrik telepon pajak bpjs butuh inti awam balas amanah wlwpun nilai berat
netral,ketemu ya nomor whatsapp bayur bekas kebun merdeka harga fluktuatif normal kisar kilo gabah kering
netral,tutup debat prabowosandi ambil gaji presiden wakil presiden sumbang rakyat kaum duafa
negatif,gaji prbwo sandi kaum duafa uang tilep ratus milyar masuk kantong pribadi ya aduh miris
netral,demokrat prabowo harga kontribusi presiden
netral,pilih prabowo sandi sumbang gaji anak anakyatim dhuafa
netral,interest prabowo sejahtera rakyat technologi agen capai jokowi coba tonjol tahu makro ekonomi lengkap tisik tahu digitech dorong
netral,sandiuno prabowo mardanialisera fadlizon prabowo bang sandiuno turun harga listrik butuh jangkau keluar kartu kartu
netral,junjung ekonomi makro main mobile legend
positif,gaji pokok ambil fasilitas negara ambil gaji pokok bulan sandiuno ambil aku hebat
positif,sepakat kubu alih serang personal pimpin jokowi mngkin lupa infra ekonomi meerrka nikmat aksi kerja tri indonesia timur mas
negatif,gaji awam kerja timses
netral,trump prabowo sandi janji ambil gaji sandiuno
netral,komitmen ambil gaji pilih mana gaji prabowo sandi
positif,ekonomi syariah pariwisata halal nyata pakde jokowi presiden
netral,wowo keliru arah ekonomi akibat deindustrialisasi salah daftarpresidenamerikaserikat presiden jokowi indonesia ngehoaks salah
netral,kait nyata prabowo harga pimpin
netral,dibukuny konsep prabowo impor hutang negeri joran tingkat rasio pajak tutup kran bocor apbn industrialisasi meningkatkn gaji tegak hukum kurang korupsi kuat
netral,ekonomi cacat arah wowo salah presiden jokowi
positif,jujur tuju gimana ya debat kemarin beranggarlidah capres tonton turut jokowi ngomongnya ngerti teori ekonomi mikro makro tangan bangga
positif,prabowo persis kemarin langkah asas baik acang ekonomi kapitalis rusak presiden banghilmi
netral,watch nyata kulit prabowo sandi komitmen ambil gaji percaya youtube
negatif,pres jokowi tanggal april libur nasional tolong lindung coblos kerja suruh masuk april masuk potong gaji tindak usaha taat pres jokowi
negatif,jokowi rakyat bilang citra akting sholat cela prabowo ngaji wudhu cacat melek ajesih ketaker otak astaga
netral,kaya jokowi salah satu asset tanah property harga
negatif,prabowo sport ekonomi indonesia
negatif,simple harga tiket pesawat indonesia timur turun anak buah jokowi bicara turun harga tiket pesawat kali lipat korban pilih bohong
positif,bahas harga pisang turun
netral,koalisi prabowo harga
negatif,bang hitung jokowi terima pajak
negatif,duuuh sebut kondisi ekonomi indonesia salah arah salah presiden presiden jokowi jokowi riofebriant
netral,daya beli masyarakat tingkat harga pokok stabil jangkau
netral,prabowo sandi sepakat oleh gaji pilih janji laku ulama patuh fakta integritas ijtima alim
positif,jokowi fokus bangun infrastruktur kunci perata ekonomi
netral,bangun jalan negara jalan sadar indonesia kalah malaysia bangun besar lanjut lebih malaysia potensi indonesia hasil raksasa ekonomi dunia
positif,rakyat butuh pasti harga jangkau cari kerja gampang kartu kartu prabowo sandi solusi bangsa
negatif,wanita cerewat suami cerewet tukang sayur harga jokowi
positif,regina kudhu ambil jokowi dibantuin jelasin makroekonomi
positif,want test vice president prabowo sandiuno solusi indonesia harga bahan pokok jangkau area kerja ada sejahtera ada guru tenaga medis merdeka pasien baik
negatif,gabung serang anehhh ambil gaji usaha otak untung
netral,maju ekonomi rezim jokowi coba liat tren grafik turun balik inflasi
negatif,gaji ambil kaya kemarin sumbang dana kampanye
netral,usaha puji kerja ekonomi jokowi
positif,listrik turun harga jangkau layan bpjs honorer tusuk prabowo sandi
positif,tuju aku prabowo ekonomi bawah perintah jokowi
netral,kriminalisasi ulama turun harga butuh flora listrik hukum tegak berat tentang
netral,bandarudara kertajati selesai tang jokowi gera ekonomi awam
positif,ekonomi makro jadi alas maju ekonomi rendah ya jokowi ambrol laku ganti
netral,perintah jokowi dukung kembang ekonomi digital
netral,prabowo sandi komitmen pilih kepala negara ambil gaji
positif,sabang merauke bhineka seorangdiri agam indonesia nkri jaga idiologi pancasila rubah harga mati
netral,analis politik ekonomi jokowi kritik bijak
netral,coba ulang debat jokowi anggap prabowo maju ekonomi digital bahwasanya esport bilang prioritas
netral,dirut jakpro isi bendahidup sandi menang tender sedia susu usaha prabowo ungkap apa arti tukar receh gaji pokok jabat awam mending citra ambil
netral,ketua jokowi khmarufamin erick thohir sayang nyata calon oposisi wowo salah presiden jokowi ekonomi negara kacau bocahsosmed sukangetweet saaebunglon
negatif,bodoh drama hoax kubu wowo partai demokrat leceh koar harga
negatif,dermawan tujukin tiga cina aseng bangga anti aseng usaha sukses kredit macet beda prabowo sandi presiden gaji derma
negatif,perintah kompeten daya ekonomi rakyat lihat juta rakyat pintar daya hadap pimpin bodoh pimpin nasional salah
netral,prabowo sandi janji ambil gaji menang pilpres
netral,paguyuban suami laki gaji paspasan nuntut beliin hermes jokowi
positif,state pakde naik gaji tunjang prabowo janji
negatif,malam omong ekonomi prabowo sandi senyum simpul tanda
positif,masya allah komitmen prabowo bang sandiuno ambil gaji jabat
negatif,ehhh buseh anak lulus ekonomi paham bilang fakta
netral,beranggarlidah malam tutup ajar harga jurus kartu merdeka komitmen ambil gaji peser prabowo sandi suka silah tentu tanggal apr
netral,sandiuno prabowo mardanialisera fadlizon prabowo balik jokowi singgung sektor ekonomi lapang kerja fokus dunia digital hype jaman dasar negeri
positif,hmmm mantap pilih jokowi paslon bahas ekonomi makro global paslon anak bayi ngerti lihat ajar paham nyata
netral,dampak ekonomi langsung asi games liput tahap konstruksi operasional pelihara datang unjung kontribusi tumbuh nilai tingkat output sektor serap tenaga kerja maju dapat riil jokowi hebat
positif,program pakde jokowi pengguran gaji bats nganggur adik lelah bang
positif,guna game online pasar konsumen transaksi puluh developer game diri rubu lapang kerjaada pajak masuk pajak ya subsidi pertalite motor ngerti
positif,jokowi pimpin optimis harga anugerah bukti jokowi sosok pimpin aku integritas
negatif,prabowo pernak tum hkti hasil pandai bicara bilang ngaku baik nyalahkan mantan pimpin rekam jejak mimpin usah hancur gaji karyawan beres
negatif,prabowo sandi presiden janji pakai gaji kayak jokowaw kampanye pakai fasilitas ada wkakwka
netral,politikus demokrat ruang debat pilpres nyata prabowo salah presiden sebelulmnya ekonomi salah indonesia maju
netral,fadli prabowo ingat ekonomi indonesia pijak pasal
positif,sandi pesona cerdas papar sukses laku bisnis insyaallah ekonomi prabowo sandiuno baik
netral,ratio amnesty usaha laku ekonomi berat teriak jalan perintah jokowi bidang pajak efektif bukti tembus target terima
netral,beda visi misi ekonomi jokowi prabowo sandi
netral,prabowo sandi tegas ambil gaji pilih
negatif,nginti yunartowijaya atabdillahtoha ngacaaa ngajarin sandi ekonomi banding jokowi
positif,ahaha dikuliahin pakde ekonomi makro
positif,yusuf mansur ukur amin sosok ideal iring jokowi maju pilih daftarpresidenamerikaserikat pilpres beberapa harap bicu ekonomi syariah
positif,best quote coblos prabowo sandi berinfaq gaji sumbang kaum dhuafa anak yatim
positif,mantap jiwa prabowo sandi oleh gaji daftarpresidenamerikaserikat
negatif,pokok prabowo hancur ekonomi salah jokowi salah presiden
negatif,tumbuh ekonomi kualitas dar angka presiden
positif,hahaha takdelah aruf amin calon naib presiden jokowi pimpin majelis ulama indonesia pilih prabowo jokowi ekonomi presiden
negatif,tanding kalah gubernur indonesia anies wina lompat pakar ekonomi kelola fiskal harga masy tingkat aja makan cancang pinggang kencang sabar sorry biasa jalan kenal sensi
positif,niat maju kembang lokal bagus dana riset kembang game game android kembang ekonomi digital happynes dreadout touchten game androidnya game game sport
negatif,masuk otak jokowi ekonomi digital bidang sport putar uang hadiah perintah gerombol pajak situ nonton debat perhatiin
negatif,bagus dukung jokowi tebang pohon curik gergaji cabang elektabilitas nyungseb lawan politik tolol pelihara dasar ebong
negatif,haha ahmak prabowo ikhlas gaji ada pilih
netral,erizeli jely bandaro admin beda sikap debat kaji debat capres jokowi istilah makro makro bijak ekonomi makro makroekonomi liat
negatif,keluar kartu sembako murah perintah baik ekonomi indonesia
negatif,prabowo sandiaga gaji tunjang jabat mana perintah sipil tunjang jabatann gede
negatif,gaji sumbang rakyat wkwk jaman purba
negatif,tolol lap miraprojo ekonomi bangsa lari game hancur generasi klok model gin indonesia ekonomi berkutet
positif,gaji prabowo sandi ambil peser bukti beliau juang penting rakyat bangsa negara
negatif,jokowi kelas entok sbenernya gubernur itu uji urus kota jakarta ngaco dukung ngotot periode kerja infrastruktur ekonomi insfrastruktur instrumen
netral,jokowi prabowo takut blunder ekonomi kupas
negatif,tolong beda startup monetizing hobi monetize nilai ekonomi gelintir orang laku butuh bahwasanya allah beda lebar
netral,jadi negeri jelas kuasa ekonomi kuat awam sejahtera ambil prabowosandi adil ampul jaya
positif,prabowo sandi abdi awam bukti beliau terima gaji rupiah
positif,menggambil gaji bentuk ikhlas oleh indonesia arah saudara saudari percaya allah baik indonesia salam tenang prabowo sandiuno
negatif,ekonomi salah arah disalahkn wowo presiden daftarpresidenamerikaserikat seblm jokowi personal sbyudhoyono bukti menyalahkn rachlannashidik agusyudhoyono
netral,pilih prabowo sandi ambil gaji
negatif,bilang rela gaji ya presiden diincer gaji proyek
negatif,janji kampanye jokowi fatal kartu sembako murah alas bilang harga bukti impor klaim naik konsumsi masyarakat ganggu like bikin kad
positif,presiden tolong program pertama harga tiket pesawat puasa lebaran diturunin kayak kemarin kasihan anak rantau rindu rumah puasa lebaran rumah kangen masakan emak jokowi sandiuno prabowo
negatif,lampau optimis sombong takabur beliau optimis janji masalalu capai optimis harga sawit anjlok optimis harga karet terjun optimis optimis tumbuh ekonomi optimis
negatif,ya janji bicara bikin cetakbiru ekonomi kembang rong capai kalah malay thailand
netral,jokowi tegas pancasila nkri bhinneka tunggal final harga mati tali berita
netral,orang paham ekonomi bantu prabowo
netral,prabowo janji harga karet kelapa sawit bikin senyum tani
negatif,serius ya liat debat malam presiden jokowi ngerti ekonomi presiden
positif,kampanye rakyat bantu sukarela sumbang dana juang prabowo sandi insyaallah ganti gaji sumbang rakyat potong pajak
positif,jokowi abis ajar makro bisa counterattack pakai istilah ekonomi wkwkwk
negatif,gaji ambil proyek jalan
netral,salah wacana manfaat teknologi sport patut acung jempol bekas regulasi angin segar putar ekonomi pajak bidang kawal anak muda aktivitas positif negara wadah misi
netral,gunung mnjulang proses itulh harga cara ikhlas dasyat sombong kebesaranya ayo menangkn prabowo sandiuno
positif,hmmm bilang debat ekonomi indonesia salah jokowi salah pimpin gemar salah jokowi ya bos bilang salah jokowi mantap pilih jokowi
positif,nikmat proses mahal murah wajar inflasi jaga harga sembako turun main medsos beli paket data mahal murah kebel
negatif,presiden anggap main bocah solusi ekonomi nasional habis jokowi
netral,statement prabowo sandi ambil gaji peser penting rakyat merdeka
netral,dasar negara ideologi pancasaila nkri bhineka tunggal final harga mati ganggu gugat jokowi
positif,nyatnaya pemerinta jokowi dukung kembang ekonomi digital
negatif,prabowo bilang hancur ekonomi gara ketua bahwasanya hitung proporsional pimpin kuasa ya arah merdeka order mimpin sehat bambanggg
netral,prabowo sandi wakaf gaji presiden wakil
positif,pilih kaya alam nusantara emas migas bumi uang negara habis masuk bank negeri cetakbiru terima merdeka gaji daftarpresidenamerikaserikat prabowo sandiuno kelas kakap ikan teri bawah
positif,salah prayitno nilai calon presiden nomor urut blunder kritik buruk performa ekonomi indonesia jokowi wetliar enak jidat
netral,jokowi sebut lembaga tumpu maju ekonomi perata hasil adil
negatif,hahaha komentar hubung ekonomi daya beli silah bantah dapat bantah argumen layak orang beril tahu dar koar
positif,please them that prabowo sandi ambil gaji presiden wapres gaji sumbang kaum dhuafa kerennn bukti beliau wakaf harta jiwa nkri
positif,alangkah baik prabowo sandiuno gaji presiden wakil bantu jabat endingnya beri pahala sekian
positif,prabowo bang sandiuno niat ambil gaji pilih nyinyir langsung nararongol gaji tunjang gede sedekah dipamerin kampanye bawa agama amal terima pamer gusti gin hatred
positif,prabowo bicara presiden jaman soekarno jasa negara harga jasa beliau
positif,harga bahan pokok jangkau tenaga medis pasien baik sejahtera guru honorer mudah lapang kerja tusuk prabowo sandiuno time have president proud stand people
netral,amarah prabowo gara warta merdeka ekonomi
positif,coblos prabowo sandi pahala gaji prabowo sandi sumbang yatim orang miskin tusuk pahala alir
negatif,sandi lulus amerika khatam makro mikro hilang sarjana hutan jokowi jurus ekonomi
netral,dunia gaji ekor negara prabowo merdeka sandi
netral,sehat harga harga ribu beli pangkal agen spbu sedia antri desa makane duit kerja keras
negatif,jebak kapabilitas jokowi kepala lepas kaki ikat trlihat bijak ekonomi makro salah fokus cari utang bayar angsur ekonomi mati parlente munculah mobile legend support bappenasri bpkpgoid
negatif,iya sprtnya sehat raut wajah gubernur masak biarin anak makan kerja citra mlulu bayar rakyat makan gaji buta
positif,prabowo persis kemarin langkah fundamental baik sistem ekonomi kapitalis rusak presiden banghilmi
netral,prabowo kilah maksud jokowi ekonomi indonesia salah arah pimpin
netral,berita baru prabowo naik pajak persen tahun
netral,ayo kpuid kpuri merdeka usut gaji rakyat
positif,wajib jokowi periode harga mati
positif,jokowi periode harga mati
netral,presiden jokowi raja salman sepakat tingkat kerja ekonomi
negatif,suudzon samping umroh jokowi bahas kerja bidang ekonomi perintah arab saudi nyinyir urus junjung ziarah kubur moga nyembah kubur
positif,bangga bangkit eksploit merdeka ekonomi bangsa dialog wirausaha bang indrauno swulllll tum dorong pepes okoce duduk muding denpasar titik pepesofficial bfjakarta prabowo sandiuno
netral,prabowo sandi komit ambil gaji allah prabowo sandi indonesia luas komit ambil gaji setor negara sandiuno
netral,khmarufamin apr ambil jokowi perintah sebut ekonomi indonesia tangan anak muda kreatif
positif,nyata tutup gemilang kartu ambil gaji kali tusuk prabowo sandi tambah prabowo dana desa inisiatif beliau jabat sebgai ketua hkti politisasi
netral,sandiuno prabowo mardanialisera fadlizon salah arah bangun ekonomi indonesia lampias andil presiden jokowi anjay
netral,prabowo bumn benteng ekonomi indonesia benteng goyah
positif,presiden jokowi raja salman sepakat tingkat kerja ekonomi
positif,presiden harga beda salut
netral,deret menteri kabinet kerja presiden jokowi wakil jusuf kalla bidang ekonomi raih harga internasional kurun jalan
netral,prabowo sandi buat gaji gaji
positif,bagi sempat bicara jokowi aruf amin bilang asai ekonomi mikro makro birokrasi perintah budaya betina perban syarih syariah asbun
netral,capres joko widodo jokowi tekan perata bangun wilayah indonesia infrastruktur tumbuh ekonomi tingkat
netral,gara gara timpang ekonomi prabowo salah presiden jokowi jkfc paltiwest alvinolulu katerinakwari
positif,program amnesty aku dunia selamat ekonomi ada duet jokowi mulyani teopebegete
positif,wowo salah pakde jokowi salah pimpin pimpin kelola ekonomi negara alhamdulillah pakde
negatif,baca tema pengaruh game ekonomi disambungin tani beda tema bosque
positif,daniel berayalayalan prabowo salah langkah baik ekonomi dalamnegeri salah arah
positif,bismillah rabu apr coblos prabowo merdeka sandi samahalnya amal gaji beliau sumbang dhuafa
negatif,bayar jalan langsung pajak gabayar darimana duit awat
netral,prabowo ekonomi salah arah cacat daftarpresidenamerikaserikat presiden jokowi
positif,rupiah gaji ambil negara rakyat miskin dhuafa ragu
negatif,harga komoditi anjlok jokowi solusi ngasal
positif,preseden fenomenal ahok keras tajam keluarga miskin jakarta gusur cerabut sosial ekonomi tinggal modal podmoro behave lembut penuh kasih sayang ujung dirut kembang masuk ahok tumbang
netral,jokowi salman sepakat tingkat kerjasama ekonomi
positif,masuk akal prabowo sandi sandiaga ambil gaji wakil gubernur
netral,daftar presiden jokowi urai singkat kerja ekonomi
negatif,gaji presiden wakil tunjang ambil peser tunjang kuasa jual nama basi
negatif,anggota kpuid layak gaji malu utama perut gede bacot minim toreh prestasi jokowi
negatif,aksi bincang mobile legends memang anak kaki gamers suruh main game ngaji kerja
negatif,gaji ambil proyek dikuasain kroni kroni njamin butuh hidup situ keluarga main milu rakyat planga plongo jadi senjata
positif,sisi industri kreatif merdeka inovatif global jokowi alih ubah badan ekonomi bekraf menteri coblos kerja
netral,prabowo sandi dedikasi ambil gaji rupiah pilih mana mobile sandiuno
positif,hmmm bilang debat ekonomi indonesia salah jokowi pimpin fanatik salah bahwasanya bos mantap ambil
positif,prabowo sandiuno ambil gaji rupiah pilih presiden orang ihlas indonesia prabowo
netral,dasar ada pancasila nkri bhinneka tunggal final harga akhir ganggu gugat jokowi
netral,jokowi ban bangun infrastruktur rencana matang turut bangun infastruktur tahap bangun ekonomi makro
negatif,bijak antek orba pikir letjen pecat bilang biang kerok ekonomi indonesia presiden jokowi jenderal gimana demokrat alih dukung jokowi coba
negatif,rachlannashidik ekonomi indonesia hancur ulah bahwasanya jokowi periode mmbuat rakyat sejahtera bobrok prabowo dismpaiknnya penuh semgat
positif,subhanallah kali sejarah bangsa presiden wakil ambil gaji awam nihh lupa kawal milu
netral,maju ekonomi perata timpang jokowi
positif,mmng dukung presiden negeri hina sdngkan orang negeri harga presiden jokowi
positif,prabowo sandi keren gaminta gaji bayar allah moga hari senang
negatif,aduhhhh ekonomi diposting tuan nilai tukar rupiah dacing dagang indonesia forum internasional
positif,capres bilang debat ekonomi indonesia salah jokowi salah pimpin gemar salah jokowi ya bos bilang salah jokowi
positif,bangun infrastruktur bangun masiv tingkat ekonomi bangsa terima kasih pakde jokowi
positif,jokowi khmarufamin april pilih merdeka ngerti ajar ngaji jabat murni dalam agama unsur citra
netral,jokowi ubah pandang ekonomi orang hubung indonesia produktif efisien
netral,beda visi misi ekonomi jokowi prabowo sandi
netral,giat selenggara kali luncur presiden jokowi april tema implementasi making indonesia indonesia negara ekonomi dunia
positif,penetrasi prabowo sandi pahala gaji sumbang yatim orang miskin camuk cucur
netral,keluh ekonomi deindustrialisasi jokowi yudisaputra
netral,listrik harga butuh pokok jangkau
negatif,ekonomi digital prabowo erti
negatif,debat jokowi salah fatal bilang harga elektrik indonesia cacat murah dunia nonton acara rakyat wawas simpati sandi
netral,menang pilpres prabowo sandiaga pasti ambil gaji merdeka
netral,gaji transfer hemat ongkos
negatif,bloon ya jakarta suram pimpin jokowi tumbuh ekonomi jakarta rendah
negatif,dosa jokowi urus soal tipu rakyat terima gaji harga rakyat anggap bodoh
negatif,wkwkwk poin terahir depat hancur ekonomi prabowo salah jokowi salah
negatif,cabut subsidi kmana lari bangun infrastruktur hasil ngutang ekonomi ktanya roket macet pakai korupsi partai dukung pdip salut subsidi rakyat indonesia tara ekonomi
