sentimen,tweet
positif,maksud sombong pelihara keluarga kartu pabowo sandi lanjut bahwasanya janji ambil jokowi saudara ekonomi untung bantu kad
negatif,prabowo bicara pert ekonomi mandek impor panen raya
positif,ekonomi indonesia jokowi ngehoaks salah presiden
positif,alhamdulillah moga laksana cita janji ambil gaji merdeka larang pilpres prabowo bukti cupar
netral,video sudut pandang beda jokowi prabowo video bahas real energi sosial lingkung ekonomi politik budaya batubara
netral,menang pilpres prabowo sandi janji ambil gaji metrobali
netral,herba jokowi beraja salman saji nasi mandhi warta ekonomi
positif,great closing statement from next indonesian leaders prabowo sandiuno komitmen dua ambil gaji rupiah amanah
netral,silah ambil prabowo sandi gaji peser pilih
positif,ekonomi masyarakat bagus jajan warung restoran mall ramai jaman modern ribu pakai gopay nikmat cacat presiden salah aktor usaha
negatif,digital swasembada pangan harga murah butuh masyarakat dasar prioritas periode
positif,bukti wagub gaji ambil debat jual bakso anak angkat saham games rakyat kenyang main kocak kelas presiden
negatif,pikirin mikir presiden kerja rakyat diam mbok molor jokowi keras harga tidur wowo pilih
positif,tumbuh ekonomi konsisten alas pilih jokowi
negatif,ambil gaji juta bijak alir untung trilyunan rupiah perusahaann pribadi janji basi prabowo sandiuno
positif,alhamdulillah prabowo sandi terima gaji pimpin sumbang penting bangsa negara indonesia adil ampul
netral,sport bisnis perhatiin ada developer game pondasi ekonomi rakyat negara bagus banyak butuh dukung perintah besar contoh taiwan singapore
positif,hmmm paslon bahas ekonomi makro global anak bayi ngerti intip ajar paham nyata mantap ambil jokowi
netral,demokrat prabowo harga kontribusi presiden enam
positif,rakyat titip harap prabowo sandiaga ubah ekonomi adil hukum polihkan rukun bangsa negara tetangga suku agama
netral,prabowo sandi ambil gaji netizen subhanallah pimpin sejati
netral,pajak income pajak kendara pajak usaha
netral,bintang debat kali jokowi sandi ya cucok bahas ekonomi usaha yekan
netral,jokowi masuk kuat ekonomi
netral,sandi kerja tambah tusuk prabowo sandi ekonomi maju tusuk prabowi sandi tagih listrik turun tusuk prabowo sandi tambah bikin mantan sakit tusuk boneka santet
positif,jokowi ekonomi digital alhamdullilah prabowo mantap
positif,prabowo sandi ambil gaji sumbang yatim duafa niat sejahtera rakyat moga allah mudah langkah presiden wakil presiden berkah allah amin
negatif,bicara ekonomi digital sama promosi kartu mustahal bola salju
netral,pilih prabowo sandi sumbang gaji anak yatim dhuafa suaraislamon
positif,bagus harga jokowi
negatif,prabowo didik angkatandaratamerikaserikat ayah ekonom legendaris indonesia bahwasanya kali ngerti makro mikro ajar semester fakultas ekonomi cmiiw tau ajar kacaw
netral,prinsip turun harga naik dapat ekonomi equilibrium imbang mudah pakai logika pikir damai
netral,erickthohir kurang dana plisss biar dukung jokowi amin peduli harga suara
negatif,bilang trans papua karya jokowi heboh indonesia protes nyata orang bilang bangun ekonomi salah arah salah jokowi salah presiden diam indonesia krik krik krik orang sungguh sakti
positif,ijin bang aspirasi teman desa hasil utama asal lada merica semenjak rezim kuasa harga lada murah harap prabowo sandi kuasa mengstabilkan harga
positif,barangkali trend maju ekonomi cengkeram cacat jokowi
positif,trimakasih kemenpu tniad jokowi prjuangan pelan alhmdllh masy ujung rasa manfaat infrastruktur senang pajak bayar negara pakai
netral,nalar bahas ekonomi makro bicara mikro keluh harga nyambung geblek motong rumput mesti pakai cengkrong pakai gunting kuku
negatif,sandi singkat tusuk prabowo sandi kerja tusuk prabowo sandi harga turun tusuk prabowo sandi cuek tusuk prabowo sandi
negatif,parah malaysia bayang orang beetumpu warga negara kritik marah liat laksana swperti gaji uang negara
netral,nyata tutup debat jokowi khmarufamin maju ekonomi sejahtera rakyat upaya nyata bangun bidang infrastrukur bangun revormasi subtantif rasa
netral,jokowi ekonomi perhati kelola ekonomi mikro ekonomi makro
positif,komentar bagus alangkah indshnya bilang merdeka jokowi lawan sang tantang gosip bilik aspirasi masyarakat indah harga
positif,sumatera selatan asi games dampak ekonomi langsung prediksi hasil triliun indonesia maju jokowi kuasa
negatif,gaji kembali negara yatim dhuafa prabowo sandi elit cinta negara patriotik
netral,impor mudah imbas harga sembako kaing mahal keluar jual murah rugi tani genjot link beli baik melek teknologi
negatif,mabuk ya harga aksi merdeka kerja presiden bisa salah orang prestasi
netral,larang pilpres prabowo sandi janji ambil gaji bal netizen
positif,preseden fenomenal ahok keras tajam keluarga miskin jakarta gusur cerabut gaul ekonomi tinggal modal podmoro behave lembut penuh kasih sayang ujung dirut merdeka kembang masuk tumbang
positif,program ekonomi prabowo sandi konkret
positif,ambil gaji bang pribadi tega prabowo sandi ambil gaji ikhlas bang rakyat abang ambil bismilah
negatif,yuuk amal hadiah coblos prabowo sandi presiden wapres gaji gila
netral,ekonomi tumbuh gagal ekonomi perata ekonomi impact tumbuh ekonomi perata ekonomi berimpact tumbuh ekonomi ya gagal nama
positif,rupiah merdeka gaji ambil negara rakyat miskin dhuafa ragu
positif,berani ganti bidang ekonomi hukum srek mohmahfudmd cawapres kurang cepat perintah optimis jokowi
netral,jokowi ban bangun infrastruktur rencana matang turut merdeka infastruktur tahap ekonomi makro
negatif,ajar makro ekonomi salah prabowo sandiuno menang
netral,kasih angka hasil gamer ngelebihi gaji umur hidup amda
positif,salahin males urus anak ya ekonomi salah persepsi anies prabowo
netral,bahas smule ekonomi rakyat game mobile legend
negatif,salah jokowi turun stabil harga toge ya bikin bijak jual toge eslen ngomel dikomplen harga mahal kena sanksi pidana
negatif,hati nyata ambil gaji kaya aparatur negara tunjang tunjang gede prabowo komen freeport krosscek
netral,nyata tutup oposisi komitmen sumbang gaji jabat kontribusi sejahtera masyarakat janji mudah sektor perintah cipta sejahtera rakyat tusuk prabowo sandi your turn
netral,pilih prabowo sandi ambil gaji idntimes
negatif,jokowi main dukun hujan periode ekonomi tanda gagal
negatif,muslim kaffahnya gaji karyawannya bayar ngemplang pajak panama papers lupa indonesia bubar maju jalan lucinta luna suka batang homo ingaaaat
netral,fokus unicorn dunia digital contoh ecomerce memamg harga murah putus mata rantai distribusi sehinga distributor jual langsung barg masarakat bagai keutungan sbgai ecer
netral,kritik prabowo ekonomi jokowi debat
negatif,anteng sebar hoax maju ekonomi persen bikin anjlok persen jokowi
netral,jokowi imbang serang prabosan mikro sengaja embus visi makro bidang ekonomi digital bahas sisi sandi alami salah fatal sebut data
netral,prabowo sandi giat ekonomi keluarga topang perempuan
negatif,bicara mudah janji ekonomi tumbuh atas omongane sehat
netral,gileee ratus juta mata tonton saksi aku berani jujur bijak ekonomi salah jokowi salah orang koalosinya prabowo sandi peluk erat tanda bericara didpn
negatif,wowo salah arah ekonomi akibat deindustrialisasi salah presiden indonesia jokowi
positif,hmmm bilang debat ekonomi indonesia salah jokowi salah pimpin gemar salah jokowi ya bos bilang salah jokowi mantap pilih jokowi
negatif,dengar debat presiden malam sebut mobile legend game upgrade level tuju debat bahas bangsa ekonomi kait uang nilai ekonomis negara buat aplikasi game
negatif,paradoks tuduh prabowo radikal tuduh prabowo harga ijtimak ulama hadewww
positif,prabowo ekonomi indonesia salah arah ekonomi makro salah arah dampak ekonomi mikro rasa dampak emak masyarakat kelas tengah bawah pandang indonesia dukung pikir pikir argumentasi kuat
negatif,utang usaha lunasin ambil gaji iya daftarpresidenamerikaserikat banding untung jabat main apbn
negatif,program turun harga sembako tani makan sandy
negatif,bloon ya batavia suram pimpin jokowi tumbuh ekonomi jakarta rendah
negatif,gaji ambil usaha pribadi untungny kali lipat bikin mudahin orba kali keluarga kaya melintir
negatif,wkwkwkk uang gaji habis indonesia
positif,ganasssssss pimpin prabowo sandiuno ambil gaji anggap ekonomi mapan
netral,presiden jokowi raja salman sepakat tingkat kerja ekonomi news
negatif,mabar mobil legend diminngu tenang ekonomi tingkat
netral,jokowi harga papua harga jawa
netral,prabowo sandi tolak terima gaji pilih besar gaji
positif,merdeka harga papua bikin ya jokowi lawan mafia jokowi
negatif,ya allah sosok seorg jokowi berani sprti capres tolong mardanialisera fitnah presiden jalan beliau orang presiden harga curiga bilang cawapres
positif,data zaman jokowi infrastruktur mana dana desa triliun gerak ekonomi gila keren indonesia cergas pasti periode
netral,pilih prabowo sandi ambil gaji
netral,silah pilih gakbmau gaji harap gaji pilih prabowo sandi ambil
negatif,gimana main mobile legend paket kebel ekonomi lemah prabowo cerdas kena jantung kasih biar anggap manusia millenial dungu ketulungan hehhehee
positif,oohh baik pemirsah merdeka beda judul bahwasanya ambil cash pindah judulnyaaaaa gaji
netral,pilih presiden wapres prabowo sandi janji gaji kaum miskin yatim dhuafa
negatif,bincang sports jokowi sadar harga build mahal ampun turunin dollar coba biar anak indo ampang bagus
negatif,program turun harga sembako tani makan sandy
negatif,wkwkwk poin terahir depat hancur ekonomi prabowo salah jokowi
netral,prabowo bumn benteng ekonomi indonesia
positif,kadang bingung syukur infrastruktur jembatan mudah giat ekonomi timur indonesia preaiden menang bangun jawa selesai dukung jokowi jalan bangun adil rakyat
positif,prabowo sandiuno pilih presiden gaji ambil serah faedah rakyat masya allah
negatif,sumantri senayan curhat jaman jokowi presiden harga pajama drive ribu
negatif,berkat jokowi suram ekonomi awam indonesia
positif,jokowi harga akhir rakyak suka bendahidup pilih buruk dsto orang oleh depan dngan negara salam periode zaenal arip
netral,ekonomi baik rakyat sejahtera
negatif,sport tani ekonomi prabowo kuliah universitas nyambung klenger keblinger
negatif,awal mikro potret makro bijak ekonomi makro parsial pilih jokowi
negatif,prabowo sebab mahal harga harga bahan pokok bijak ekonomi indonesia salah arah ujung nyalahin
positif,maksud sombong hidup keluarga kartu pabowo sandi lanjut ya janji pilih jokowi saudara ekonomi untung bantu kartu
positif,tarik program jokowi trans sumatera ekonomi sumatera kembang
netral,jokowi bangun spbu setelag kabupaten puncak jaya papua harga ribu liter
netral,prabowo sandi maju ekonomi pangan maju daulat kancah international antar indonesia adil makmur
netral,pilih prabowo sandi gaji fakir miskin
positif,jokowi sederhana mata mata sepatu jokowi harga juta mata jokowi sederhana pakai baju hugo boss mata jokowi
netral,prabowo strategi ekonomi indonesia salah arah
positif,mobile legend sport game online angkat debat capres scope ekonomi kreatif ada platform internet perintah makes sense jokowi visioner
netral,prabowo gili sumatra uban harga karet turun drastis sawit merdeka tinggal perintah hasil
negatif,bowo debat orientasi ekonomi indonesia baris salah jokowi pimpin
positif,kisah heroik cerita orang barangkali bukti puji lekat publik tanah bincang sang begawan ekonomi indonesia prabowo sandiuno
negatif,dungu ambil sampel game populer indonesia main hasil uang main game akun jual beli anak pakai duit bapak pusing bayar kredit pajak nguras gaji
netral,donk mang sayah percaya saudara juang ikhlas negeri balik lebik masyarakat damai tenang aman sejahtera tingkat harga rendah stabil
negatif,wowo jokowi cacat salah bikin arah ekonomi
negatif,cabut subsidi kmana lari bangun infrastruktur hasil ngutang ekonomi ktanya bangkit macet pakai korupsi partai dukung pdip salut awam indonesia cukup ekonomi
negatif,nama wowo salah betulbetul bowo libat perintah dosa kondisi ekonomi jokowi fearlessdiva dengerlah
negatif,bicara sports jokowi sadar harga build mahal ampun turunin dollar coba biar anak indo gampang bagus
positif,program mantap amburadul mungut pajak event perintah benah pemunguran pasal final
netral,berkat jokowi rakyat dalam akses ekonomi mudah
positif,percaya bang sandi wagub beliau ambil gaji beliau sumbang gaji maksud prabowo suka klaim hasil pikir ayo orang
positif,celotehprabu assalammu aalaikum maaf prabowo sandi guru honor perhati guru honor honorer sekolah swasta fikiran hidup layak gaji enak yayasan sang
positif,otak sangka mobile legend apit orang cerdas pikir ekonomi rakyat
negatif,bolak singgung deindustrialisasi aneh salah jokowi salah arah bangun ekonomi indonesia lepas andil presiden jokowi
negatif,beda jokowi harga dukung prabowo harga capai presiden klaim sembunyi fakta tamak serakah rezim jokowi
positif,capres bilang debat ekonomi indonesia salah jokowi salah pimpin gemar salah jokowi ya bos bilang salah jokowi
positif,kerjasa ekonomi bilateral multilateral doa dengar suara hati
negatif,gkgkgkkk prabowo gaji santai ajja lahh ambisi hidup usaha kroni
positif,trans sumatra tunjang tumbuh ekonomi sumatera bantu perata sosial sumatera logistik bahan bakar perlu mudah kirim jalur pada jokowi wujud maju pulau sumatera trans sumatra
positif,coba paham tanya jokowi sejahtera developer kembang esport ekonomi digital sejahtera bangsa cocok infrastruktur maju game industry
positif,turun harga fasilitas peluang sedia tutup naik bhkan alhamdulillah tabung lumayan terima kasih jokowi
negatif,sandi usaha paham beda ekonomi mikro makro
negatif,jalan bagus mana gampang ekonomi smakin baik bilang infrastuktur gilir jalan jelek komen
negatif,bilang akur gaji ya daftarpresidenamerikaserikat diincer proyek
netral,flora jokowi industri ekonomi digital sport mobile legend contoh
positif,dutarakan sandi drasakan masyarakat ngeles bijak beliau periksa ekonomi mikro makro utara nangkep
negatif,gaji bayar kiani kertas pilih prabowo sandi
positif,tumbuh ekonomi konsisten alas ambil jokowi
positif,jokowi cepat merespon ubah tuntut jaman rangkul kalang hasil kerja nyata sentuh jokowi angkat harga bangsa mata dunia pilih jokowi lawan khilafah preman brjubah jual agama takut rakyat
netral,prabowo arah ekonomi cacat arah amien rais
negatif,nahdlatululama heran prabowo bilang tingkat terima pajak sandi bilang hapus pajak usaha tolak bijak coba dengar ulang debat pajak
positif,turun harga merdeka fasilitas jidar sedia lapik naik bhkan alhamdulillah dana lumayan terima kasih jokowi
netral,dengar mbak vidya curup beli lipstik purbasari harga ribu beli lipstik ribu
negatif,butuh harga sembako jangkau bukam game mobile legend anak berattulang beljar
positif,suara april jokowi amin harga mati nkri maju
negatif,bangun ekonomi perata waduuuh timpang jokowi khmarufamin pikir kesini
negatif,sedih bahwasanya mudah periode perintah jokowi harga kampret minim ribu
negatif,untung jokowi bahas mobile legend moga perhati game rakyat ampul harga bahan pokok jangkau flora hidup mobile kelas presiden putar
netral,sandi harga pangan jangkau tusuk prabowo
positif,lihai bawa ekonomi kampanye kewalahan tangkal kisah fokus jokowi infrastruktur modal langsung efek
positif,buka youtube dengar ditanyain jokowi bahas sport pokok utama ekonomi digital mobile legend salah contoh
netral,prabowo ekonomi salah arah salah presiden presiden jokowi
negatif,aku kurang ya aku prabowo kristen mualaf ibu kristen hashim kristen sholat wudhu gera salah ngaji pecat elit bajing
negatif,sesal jokowi kyai debat dirut komisaris tahan posisi debat imbang tantang orientasi kelola persh ekonomi negara
positif,bukti wagub gaji ambil debat jual bakso anak angkat saham games angkat rakyat kenyang main games kocak kelas presiden
positif,when prabowo said ekonomi salah arah salah jokowi salah presiden sebelumnyaa kalimat pilih indonesia depan
positif,want test vice president prabowo sandiuno solusi indonesia harga bahan pokok jangkau lapang kerja sedia sejahtera status guru tenaga medis pasien baik
negatif,just gon na express confussion sige jokowi kekeuh that prabowo sandi ngerti macro micro economy when kecimpung dunia ekonomi life bingung
negatif,prabowo sandiuno harga murah jangkau awam bijak sosialis apa venezuela ekonomi collapse inflasi populis seram efek
positif,main mobile legend pubg indonesia dukung penuh jokowi presiden sport peduli nasib mudah mudah harga diamond murah jangkau
positif,beda indonesia harga laku jokowi
positif,doa hati prabowo presiden ekonomi buruk ponsel tutup awam carut marut daftarpresidenamerikaserikat tolong baik masyarakat wslm hati
positif,great closing statement from next indonesian leaders prabowo sandiuno komitmen dua ambil gaji rupiah
positif,ekonomi nyungsep ngurusi mobile legend merdeka
negatif,maju bangsa adab busuk tumpuk lagu jadi reference periksa kemudi koruptor pensiun ambil gaji
negatif,salam nyata bowo salah orientasi ekonomi adab presiden jokowi sungguh luka sendiri demokrat
negatif,jokowi ekonomi sehat didik kartu serius
netral,ampun pakai subsidi pakai ygkg harga tera angka wajib tempel dinding toko biar awam mangkanya harga brubah ubah jokowi subsidi alih
positif,rakyat indonesia bangga jokowi harga raja arab saudi terima kasih
negatif,janji tumbuh ekonomi roket kata janji stop import janji stop utang janji ya lambai tangan biar prabowo sandiuno banyak ngeles
netral,kerja gaji kaga enak bahwasanya bilang doangmah honorer laden negeri janji apa bpjs kad terima samping bayar pajak listrik sbagainya
netral,prabowo jokowi program ekonomi salah arah
netral,jokowi malih anggap ekonomi orang hubung indonesia produktif efisien
positif,hmmm capres bilang debat ekonomi indonesia salah jokowi salah pimpin gemar salah jokowi ya bos bilang salah jokowi
netral,detik detik prabowo cingak celinguk paham ekonomi makro mikro simak
positif,prabowo sandi paslon papar visi misi rakyat hubung nyapun harmonis tunggal sumbang gaji maklum tajir
netral,prabowo laku rangka kembang ekonomi digital kembang sport mobile legend
netral,berita baru naik rasio pajak prabowo kenang orde
positif,gembar gembor ekonomi roket allah selamat saudara pilih pimpin bawa ubah prabowo sandi indoneaia adil makmur
positif,luarbiasa bangun infrastruktur moga infrastruktur bangun tunjang tumbuh ekonomi perata sosial republik indonesia semangat
positif,presiden aids program pertama harga tiket kapalterbang puasa lebaran diturunin kayak kemarin kasihan anak rantau cuai rumah rumah kangen masakan emak jokowi sandiuno prabowo
positif,balik intip tampil prabowo sandiuno aduh mudah ambil gaji masyaalloh
positif,kerja makan gaji orang anak muda talenta bakat dunia game anggar dukung maksd nyata
positif,pilih pimpin capai capai ekonomi perintah jokowi coblos kerja
netral,koalisi prabowo harga
netral,jokowi capai tumbuh syukur indonesia tumbuh kondisi ekonomi global gejolak
positif,baca sejarah darah darah ekonomi china bangun infrastruktur mudah asing investasi kawasan industri lihat ngaco luar perintah hadeeeuh
negatif,prabowo ngaku nasionalis salah kaprah bicara gede korban jiwa raga diam rumah mewah kuda kuda mahal karyawan gaji bayar patriot ndasmulah
negatif,hancur ekonomi rusuh sosial
positif,aman negeri baik merdeka ekonomi asas didik birokrasi maritim hasil arah arah y jokowi periode
positif,ekonomi salah bangkit bangsa terus perjuagan prabowosandi padang lawas sumattra utara rajuddin harahap prabowo sandi dukugan presiden wakil amin
positif,padan kang perintah kasih mudah kita eksploit kreatif ya beras organik domestik harga mahal lancar
positif,data coba pakai analisis ilmu ekonomi maaf bahwasanya debat jokowi bedain makan hoax based haha tarik
negatif,terima gaji amanah jabat singkron waktu kompanye terima uang emak emak prabowo sandiuno milik cukup ekonomi finansial
negatif,bocor sandi bankrut keluh orang jadi referensi ekonomi juta orang akal sehat hilang
netral,prabowo bumn benteng ekonomi indonesia
negatif,aduhhhh ekonomi diposting tuan nilai tukar rupiah neraca dagang indonesia forum internasional
positif,presiden jokowi bangun spbu setelag kabupaten puncak jaya papua harga ribu liter liter
netral,ekonom csis fajar hirawan faktor eksternal sebab tumbuh ekonomi jangka rahsia capai
positif,rasa peluh keringat rasa dukung gerombol pagi harga daulat rakyat
netral,mosyantax demokrat prabowo harga kontribusi presiden enam
positif,ucap prabowo bang sandiuno sumbang gaji pilih mantap tentu pilih
negatif,baca tema kuasa game ekonomi disambungin tani beda tema bosque
negatif,nyata debat malam prabowo timbul kontroversi teri gaji jabat presiden pilih rakyat takut uang ganti milyaran ambil
negatif,gagal ngapain stagnan debat bahas mobile legend ekonomi indonesia
netral,pilih pimpin capai capai ekonomi perintah jokowi
netral,bangun revitalisasi pasar rakyat jaga stabilitas harga sedia stok bahan pokok satu produksi adab tambah ekspor mandat daftarpresidenamerikaserikat jokowi
netral,pimpin ikhlas cari gaji ya kerja pilih prabowo sandi bela negeri
positif,janji ngehapusin pajak bikin hutang negara mbak pajak negara
positif,sayang jokowi kyai debat dirut merdeka komisaris tahan posisi debat imbang orientasi kelola persh ekonomi negara
positif,wajar jokowi iriana berkat istri pungam beliau fokus baik ekonomi salah arah puluh prabowo hasil nyata
positif,cadasss bang ambil gaji fokus sejahtera rakyat salut allah senantiasa rahmat atom
positif,woow gaji prabowo sandi ambil sumbang pilih masyaallah prabowo sandiuno gerindra
netral,presiden jokowi merdeka beraja salman bunga temu bilateral istana pribadi minggu koreng april bakda jamu santap siang daftarpresidenamerikaserikat sepakat tingkat kerja bidang ekonomi
negatif,aduh derita otak tinggal jaman batu jokowi melek digital onlen ya bayar gaji pegawai urus kerja negara wkwkwk
positif,prabowo sandi kepiawian sega presiden adab beliau perhati pangan ekonomi rakyat oleh indonesia daulat kancah international giring adil ampul
positif,sabang merauke bhineka tunggal agam indonesia nkri jaga idiologi pancasila rubah harga mati
negatif,prabowo enggak prepare persona agam kaya ajar ngaji gtgt menang ya counter jokowi rekrut bikin tebak alur wkwkwk asli islami asli biar
netral,demokrat koalisi dukung oposisi salah nyata prabowo debat pilpres anggap salah kait kondisi ekonomi indonesia
negatif,ehhh buseh anak lulus ekonomi paham bilang fakta
netral,prabowo milik jiwa sportif salah bijak ekonomi indonesia puluh jokowi kuasa sayang partai koalisi suka emosi jujur prabowo ungkap fakta aneh
negatif,ya semenjak perintah jokowi harga karet kisar ribu kebon orangtua ubah kakao kolam ikan salah perintah
netral,prabowo nilai ekonomi salah arah presiden jokowi
positif,namnya alap otak lalap berisik susah aku harga kerja jokowi kerja fakta nyata aku benci intim gadang otak lhooo pindah jalur baris afiat
negatif,ngajarin prabowo sandi ekonomi makro pintar plonga plongonya laut garam tuman
negatif,berita salah salah buat keliru ekonomi indonesia prabowo muka publik salah konyol
positif,hahahaha sumbang gaji dana operasional presiden wapres berani dana operasional mknya jokowi beli sabun sepeda sembako dana operasional rakyat
netral,jumlh buku sale brap harganyafaldomaldiniprabowo tolong
netral,bangsa harga budaya indonesia nusantara
negatif,sandiuno paham merdeka apa laku negara orang sekitar masuk ekonomi cawapres
negatif,ambil jokowi dibegoin liat harga iya gaji kerja ngabisin kopi pantry biro heran
negatif,banding kala soeharto cacat ekonomi sad
netral,bumn kuat benteng ekonomi camuk prabowo sandi
negatif,prabowo bahas ekonomi merdeka negara mobel lejen suka sedih
negatif,liat jokowi malu gaya senang blusukan dengar keluh kesah rakyat bijak ekonomi dengar data bisik orang
positif,coblos prabowo sandiuno bersodaqoh gaji beliau diinfaqkan duafa anak yatim insya allah
netral,vidiaamanda april pilih jokowi pilih pimpin capai capai ekonomi perintah jokowi
netral,kritik prabowo ekonomi jokowi debat
positif,prabowo sandi ambil gaji sumbang yatim duafa niat kebaji awam moga allah mudah langkah daftarpresidenamerikaserikat wakil presiden berkah merdeka amenamon
positif,prabowo harga mati titik
netral,salah wacana manfaat teknologi sport patut acung jempol wadah regulasi angin segar putar ekonomi pajak sektor kawal anak muda giat positif negara wadah misi
netral,harta nasib karyawan gaji
negatif,nyambung jokowi nyimak game online sandiaga sambung prabowo game online lapang kerja tingkat sejahtera tani turun harga tonton rekamany
netral,prabowo sandiuno ya gaji donasi nerusin sekolah
negatif,pecat ngerti ekonomi ngerti sawer
positif,presiden jokowi bijak anggar bangun ekonomi rata beliau kurang subsidi penting ekonomi fundamental infrastruktur
positif,mantap ambil jokowi paslon bahas ekonomi makro global anak bayi ngerti lihat ajar paham nyata
netral,nyata kulit debat jokowi khmarufamin maju ekonomi kebaji rakyat upaya nyata bangun bidang infrastrukur bangun revormasi subtantif rasa
netral,capres jokowi nasabah usaha mikro pesantren persen betina program mandiri ekonomi keluarga
netral,keluh ekonomi deindustrialisasi jokowi yudisaputra
netral,bahas ekonomi makro ekonomi negara sprti bumn tambang export import
netral,bangun revitalisasi pasar rakyat jaga stabilitas harga sedia stok bahan pokok serap produksi negeri tingkat ekspor mandat presiden jokowi
positif,gestur prabowo bang sandiuno alami citra nyontek tanda harga rakyat amanah percaya sandi ajak orang pilih ragu coblos
netral,psimis orang cinta game developer nyerap tenage kerja iya jual printilan dibutuhin diamond mobilegend bangun pelan langsung ngubah ekonomi makro
netral,presiden jokowi raja salman sehat tingkat kerjasama ekonomi beritarri
netral,dua ambil gaji wakaf masyarakat butuh allah prabowo sandi menang
positif,tuju kang perintah kasih mudah kita usaha kreatif ya usaha beras organik lokal harga mahal beras ya lancar
