sentimen,tweet
positif,aku janji prabowo bahwasanya spesifik harga sembako murah mekanisme gimana kasih awam ya masyarakat oportunis mikirnya nyentuh hidup betulbetul
negatif,sist debat jokowi tekad kembang wisata halal ekonomi bas syariah partai dukung anti syariah bagiamana antoniraja tsamaradki
netral,jokowi bangun spbu setelag kabupaten puncak jaya papua harga ribu liter liter
negatif,debat prabowo ajar ekonomi tiongkok lupa kampret benci china author mora sifudan capres cawapres malam usul indonesia
netral,jokowi kritik tumbuh ekonomi pamer akuisisi freeport
negatif,hahahah goblok lihat subtansi arah ekonomi salah baik nyungsep cacat
positif,ayo dukung prabowo ada negara keluar larang gaji tunggu janji pilih realisasi bendahidup
netral,selfy motret analis politik ekonomi jokowi kritik bijak
netral,kaya jokowi salah satu asset tanah property harga
netral,capai hasil capai tumbuh ekonomi perintah jokowi tingkat hyperlink
positif,moga contoh ustadz abdul shomad undang istana jabat apa prabowo sandi presiden prabowo sandi ambil gaji muncul orang ikhlas juang indonesia adil makmur
netral,wowow debat orientasi ekonomi indonesia jalur salah jokowi pimpin jokowi
negatif,tumbuh ekonomi jokowi angka saing prabowo impor ekspor
netral,y pngetahuan tata kelola ekonomi negara kelas
netral,capai hasil capai maju ekonomi perintah jokowi tingkat
negatif,harga kampret batas kaos rela panas macet hadir foto kampanye jokowi liat cebong hadir foto kampanye wowo never
negatif,ekonomi hancur gara presiden salah jokowi
negatif,salah bowo bangun ekonomi indonesia salah arah lepas andil presiden presiden jokowi jokowi tasyashee enak jidat
negatif,harga pangan murah catering banyak tusuk prabowo sandi haha
negatif,gaji kembali negara yatim dhuafa prabowo sandi elit cinta patriotik
positif,ekonomi nyungsep ngurusi mobile legend
netral,kawasan industri ekonomi khusus area pariwisata efek barang rajin desa juang mandiri papar jokowi
netral,orang paham ekonomi bantu prabowo
negatif,obrol ngalor ngidul blas urus mobile legends ekonomi nasional ada jauh bicara industri kreatif cipta nilai ekonomi ekspor jual jokowi malam
positif,adab harga apresiasi pilih ulil moga labuh abshar abdalla kubu jokowi amin insa allah napas gerbong milenial ragu bimbang tentu pilih amenamon
negatif,prabowo kaya indonesia dikiasai elite bangga aku koar anggap rusak ekonomi kaya negara malu auto hancur bangsa
negatif,antek asing ekonomi amburadul harga raja utang plonga plongo kolam berisik prabowo bilang cacat jokowi klean
netral,indonesia negara ekonomi kuat empat dunia langkah hadap rintang jokowi gelora karno jakarta sabtu
positif,pimpin selesai banyak bahan gaji ambil prabowo sandiuno
negatif,industri esports billion dollars dampak ekonomi junjung dukung katrok
positif,butuh jalan butuh hasil tani harga jual tingkat
negatif,basicnya usaha tangan ekonomi makro jabawan jokowi kesal
netral,wowo debat orientasi ekonomi indonesia jalur akibat ulah presiden jokowi jokowi salah jokowi salah
positif,tumbuh ekonomi imbang perata cegah timpang wujud adil rakyat indonesia jokowi
positif,coba putar ulang debat jokowi spesifik esport mobile legend bilang industri developer tanggap baru singgung bang sandi dukung ekonomi digital ributin mobile legend
negatif,gaji bantu struktur jabat indonesia ajaib minim tunggang fasilitas bejibun prabowo sandiuno gabener aniesbaswedan berani lepas rakyat
negatif,bayar pajak pribadi harta yangbterbongkar panama papers naik ratio tarif orang panama preeetttt
negatif,lucu sandi prabowo diajarin ekonomi makro mukidi ngajari ikan renang
netral,wowo beranggarlidah orientasi ekonomi indonesia jalur akibat ulah presiden jokowi
positif,prabowo sandiuno mandat rakyat ambil gaji jiplak dennysiregar
netral,skak prabowo sandi amburadul ekonomi merdeka macro micro memang nkri huni gelintir bendahidup
netral,ceramah damai indonesia ekonomi baik
netral,ekonomi prabowo salah arus
positif,jokowi butuh gaji nafkah kluarga jokowi haram utak atik apbn gratif dlsb beda bosan gaji sdikit lantas ngeruk darimana kerja keras
negatif,jokowi ikut kati negara heleh wakaf ambil gaji kampanye
negatif,ambil gaji sumpah pocong janji
positif,kasih jokowi bangun spbu setelag kabupaten puncak jaya papua harga merdeka ribu liter
positif,senjata pakai skak apalg bidang gada jokowi usaha didlm jalur gemes lihat
netral,harga motor mahal jokowi
negatif,jalan bagus mana merdeka gampang ekonomi smakin maju bilang infrastuktur gilir jalan jelek komen
positif,ragu prabowo sandi tegas ambil gaji pilih rmol pasang calon presiden calon wakil presiden
positif,titip amanah kepada bang tetap juang ekonomi rakyat
negatif,edunnn kelas menteri jokowi kelas jabat cakiminow dpppkb bisa nyebar hoax kemkominfo rudiantaraid gaji rakyat ngapain teman nyebar hoax biar
netral,larang pilpres prabowo subianto sandi janji ambil gaji
negatif,gaji sumbang rakyat wkwk jaman purba
netral,prabowo sandi jokowi semenjak walikota gaji beliau kasih warga solo butuh
netral,pilih prabowo sandi sumbang gaji fakir miskin
netral,consol games hardware esport manfaat dampak ekonomi masif jokowi bangga dampak esports
netral,jokowi usaha mebel solo mudzakir guru ngaji jokowi murid pulang jerman korek zippo
netral,gara cacat ekonomi prabowo salah presiden jokowi jkfc paltiwest alvinolulu katerinakwari
positif,fokus prabowo bumi tumbuh ekonomi harga jangkau fokus jokowi rakyat main game mobile legend
netral,jokowi cipta iklim bisnis kondusif paket bijak ekonomi mudah izin usaha investasi masuk indonesia menteri industri airlangga hartarto
netral,khmarufamin indonesia depan tumbuh ekonomi perata zaman jokowi bangun
negatif,prabowo bilang contoh tiongkok jelma raksasa ekonomi butuh pondasinya bangun dekade hancur bangsa soeharto puja hidup
netral,wowo pakar salah arah ekonomi datang deindustrialisasi salah presiden jokowi ngehoaks salah adji
negatif,lampau optimis sombong takabur beliau janji masalalu capai harga sawit anjlok karet terjun maju ekonomi
negatif,ekonomi hidup buruh tunggu realisasi janji tanggal februari hadap wakil istana harap
negatif,bangga mental gembel bangga harga ngeri budaya sebar
negatif,sadar rapat jokowi cerita pasang harga wapres tawar rasa
negatif,fitnah alim oposisi divhumaspolri ccicpolri diam gaji uang negara coba jokowi betulbetul gaspol aids prabowo pilih buang petinggi polri josipbroz dalam ganti
positif,infrastruktur ekonomi perata bangun gratis bangun hutang bayar pajak rakyat jaga amanah rakyat pilih menghianati demokrasi sehat presiden
positif,penting prabowo sandi komitmen turun harga listrik dukung tuju dukung prabowo sandi tuju moga prabowo pimpin tepat janji kampanye
netral,prinsip cengkelong harga naik dapat ekonomi equilibrium imbang mudah pakai logika anggap damai
positif,info mantap pilih jokowi paslon bahas ekonomi makro global paslon anak bayi ngerti sukangetweet bocahsosmed saaebunglon
positif,jokowi periode harga mati
netral,presiden joko widodo jokowi kendal harga harga komoditas pangan inti tingkat inflasi
positif,malu aku gagal janji realisasi awam pilih stop impor pergi subsidi buka area kerja ekonomi persen gerak esemka hasil wajar pimpin
positif,jokowi sepakbola indonesia dorong indonesia harga ada
negatif,jokowi pintar ngeles gagal bangun ekonomi pakai alas ekonomi makro tumbuh rendah stuck jaman presiden
negatif,balada kisah mobile legend bahagia awam prabowo digital bagus rakyat butuh swasembada pangan gizi harga jangkau kembang mobile gokill
negatif,gaji tunjang struktur gaji jabat indonesia ajaib minim tunggang fasilitas bejibun prabowo sandiuno gabener aniesbaswedan berani lepas tunjang rakyat
negatif,surga bahagia bahagia sempurna tanpa gandeng tangan prabowo ustad masuk firdaus ckckckck salah pilih guru ngaji
negatif,ambil gaji ambil uang proyek korupsi uang karyawan gajan usaha rugi ambil gaji
positif,utama ekonomi tega hukum prabowo fokus peduli sport fokus utama jokowi pemerintahanya fokus infrastruktur
positif,jelas kyai khmarufamin cawapres jokowi komitmen kait ekonomi kalang sebut arus indonesia kembang
negatif,untung jokowi bahas mobile legend moga perhati game mobile legend rakyat makmur harga bahan pokok jangkau pokok hidup mobile legend kelas presiden putar mobile legend
negatif,aduh bodoh kampret yankayak gin presidem jokowi ya otak maundi pasang goublok ikut harga pasar bahwasanya turun merdeka jatuh subsidi ilmu cetek belagu
netral,murah biar harga sembako ongkos angkot ojeg mahal
positif,niat maju kembang lokal bagus dana riset kembang game android kembang ekonomi digital happynes dreadout touchten androidnya sport
positif,jokowi negarawan asal malam sepenuh hati usaha jatuh oposisi paham masalah ekonomi institusi negara pandang kekanak kana
netral,bijak ekonomi salah arah prabowo bantah gencar bangun infrastruktur
negatif,pokok ekonomi bangkit hidup mobile legend
negatif,jessnolimit negarawan urus game sejahtera rakyat tema ekonomi alas ada tadbir faedah penting flora masyarakat games
negatif,jokowi presiden apa rusuh negara bertanggungjawab pilih rakyat anggar milu puluh triliyun gaji awam selesai problem shame
negatif,ekonomi hancur gara presiden salah jokowi
negatif,bayar gada dipikirin jokowi
netral,jokowi malam atletik arah kembang investasi ekonomi digital butuh pangan
netral,bowo beranggarlidah orientasi ekonomi indonesia baris beban jokowi ketua
negatif,koalisi serang anehhh ambil gaji usaha otak untung
negatif,petinggi jamu demokrat terima nyata hina prabowo tanda harga kader marwah jatuh sungkur cedera juang
positif,bijak jokowi harga bentuk nyata adil sosial awam indonesia
netral,menang pilpres prabowo sandi janji ambil gaji
negatif,kecwa sbgai milenial prabowo lemah bicara digital sport pasar ekonomi berfikir kolot dunia looo
netral,bicara tumbuh ekonomi capres nomor urut jokowi kait perata fokus infrastruktur pulau jawa simak sesuai nyata
positif,jokowi bangun ekonomi perintah sektor maritim nelayan dukung penuh bank mikro tuan rumah negara april coblos jokowi
negatif,harap prabowo paham harga koalisi surat sepakat jadi cawapres ingkar rakyat kawan politik penting
positif,bukti impor jagung turun impor beras turun impor garam khusus garam industri ketat impor rupiah stabil ekspor bayar ikut kembang ekonomi hujat harga presiden letak pondasi
netral,menang pilpres prabowo sandi janji ambil gaji
positif,april coblos jokowi aral dagang kembali tres lebih janji kerjasama ekonomi turki indonesia tingkat
netral,lampung aceh makan malam pakai jalan bensin irit barang cepat transport bahan pangan banyak harga flora merdeka murah bikin pokok mana
negatif,salah ekonomi arah cacat presiden jokowi california kali bahwasanya
positif,sandiuno mantaappppp bilang turun harga listrik impor panen teriak kencang mantap faktor banyak rakyak kecewa jokowi
positif,malam pakde jokowi nyinggung mobile legend akuin anak muda suka ngegame adik cowok kuliah hari profesi hasil besar ngalahin gaji
netral,prabowo sandi komitmen ambil gaji pilih sandiaga allah prabowo sandiuno
negatif,aku ekonomi indonesia salah arah prabowo salah tawar solusi simpati adu biribiri awam beranganangan citra
negatif,prabowo sandi sepakat ambil gaji negara susah
positif,komunitas olahraga deklarasi dukung jokowi hadir puluh atlet cabang ratus simpatisan harga kerja kuasa indonesia
positif,janji manis pilpres menang bebas pajak kendara prabowo sandi menang gaji kerja rakyat miskin jokowi menang anggur gaji menang
negatif,sedih ya mudah periode perintah jokowi harga kampret minimal ribu
positif,prabowo sandi komit gaji ambil rupiah kaku allahu akbar
netral,masalah hubung masalah ekonomi hadap indonesia bowo debat capres jokow widodo jokowi demokrat kubu
positif,ragu bijak infrastruktur ekonomi didik lai ragu pilih mohon adakan program jodoh nikah trans dimensi
positif,suara april jokowi amin harga mati
negatif,lohh ekspor kitaaa banyakkk panen kebun buang negara agrari full bikin kalah tani kasihan tani derita payah tanam konsumsi jokowi bicara fundamental ekonomi game akal sehat
negatif,jessnolimit negarawan urus game sejahtera rakyat tema ekonomi dasar ekonomi negara urus penting penting pokok masyarakat games
positif,apr penetrasi prabowo sandiuno amal gaji sumbang dhuafa anakyatim inshaa allah
positif,prabowo sandi komit gaji ambil rupiah mantap allahu akbar
positif,bismillah hasil beranggarlidah malam pasang prabowo sandi konsentrasi masyarakat utama swasembada gizi harga bahan pokok elektrik turun cipta lapang kerja insya allah mantap ambil padan broo
negatif,yaelaaah gaji presiden wakil rapah banding planning mauk ngembat apbn pakai markup bersil triliyunan disiapin prabowo sandi
negatif,hidup susah jam harga nail listrik
positif,ayo tusuk prabowo sandi kinclong hati rakyat capres cawapresx ambil gajinyaaaa serahkn fakir miskin kaum duafa tusuk yaaaaa debat pamugkas kan paslon prabowo sandi
positif,coba paham tanya jokowi sejahtera developer kembang esport ekonomi digital sejahtera bangsa cocok infrastruktur baik game industry
netral,pilih prabowo sandi sumbang gaji anak yatim dhuafa
positif,ragu bijak infrastruktur ekonomi didik lai pilih mohon adakan program jodoh nikah trans dimensi
netral,harga tiket turun
netral,bang sandi harga bahan pokok murah ya tusuk prabowo sandi kangen kangen member ya tusut mashook
negatif,banding balik fakta wowo sandi terima sumbang rakyat kampanye malu komment terima gaji kampanye harap sumbang rakyat
negatif,gundul jokowi rangka kuat hubung ekonomi arab curang ya lapor bawaslu anggota bawaslu pilih seleksi partai partai usung oposisi
positif,rakyat indonesia bangga jokowi harga raja arab saudi laku kasih
positif,nasionalisme beliau dunia internasional milu beliau kunjung solusi kerja kembang ekonomi indonesia mantab jokowidodo lanjut
netral,jokowi menwarkan program bina ekonomi dalamnegeri sejahtera mekaar bina modal nasional madani luncur naik sejahtera warga rumah ambangpintu tingkat
negatif,kartu jokowi bukti jokowi gagal gagal stabil harga cenderung mahal kartu sembako murah gagal sedia lapang kerja kartu prakerja gagal sedia didik jangkau muncul kartu pintar april
negatif,sayang jokowi bahas ekonomi digital guna multifungi
netral,sandi kerja tambah camuk prabowo ekonomi maju tusuk prabowi bayar listrik turun tambah bikin mantan bobol boneka santet
netral,jokowi ekonomi indonesia
netral,probowo ekonomi indonesia salah jokowi
positif,allah bagi hati pilih prabowo sandi daftarpresidenamerikaserikat mana beliau gaji anak yatim kaum dhuafa allah ilah percaya dua
negatif,obrol ngalor ngidul blas urus mobile legends ekonomi nasional ada jauh bicara industri kreatif kreasi nilai ekonomi ekspor jual jokowi malam
negatif,prabowo presiden dinasti cendana bangun kuasa orde ya gitulah harta harto swiss kena amnesti gada kemarin runding gaung
negatif,anti china gandeng cina devisit neraca dagang dipengatuhi ekonomi dunia judilnya gara jokowi dasar kampret
negatif,tentara mbak kala firaun gaji kasih kuasa arah perang pakai budak pasu berani akhir profesi prabowo kerja dunia kembang
netral,prabowo sandi ambil gaji peser pilih bismillah
netral,pimpin negara gaji paus fransiskus vatican donald trump apr tiga prabowo sandi asia
netral,post amat tanggap positif tumbuh ekonomi jokowi capai target
negatif,ambil simpul ulama ustad y bayar lisan sogok prabowo bayar gaji karyawan suap bendahidup smntara bkas lapar anak istri fahrihamzah fadlizon
negatif,horang kaya ambil gaji kroni kroni gerogot ngeri
positif,strategi oleh ekonomi pandang awam napas perhati beberapa amal pikir beda jokowi maruf praktikal prabowo sandi anggit
negatif,sandi bulak megkeritik harga harga mahal jelas jokowi
negatif,uang hutang listrik subsidi bahan bakar subsidi pangan subsidi gaji naik pajak nunggu prabowo presiden jawab gelar profesor mana
negatif,sandi ngerti ekonomi mikro merdeka makro prabowo baca sinchan
negatif,bebasin pajak kendara capres naikin ratio korban nutupin bebas
positif,prabowo concern benah tata arah negara tahan ada harga bangsa markah dunia bang sandi fokus garap kuat ekonomi sinergi perintah power rakyat ulama fokus iman akidah akhlaq umat
negatif,maaf penuh janji tumbuh ekonomi indonesia pakai ngeles alas maaf terimakasih
negatif,dengar gaji prabowo sandiaga ambil serah fakir miskin orang kaya
negatif,miskin mental miskin harta miskin harga miskin ilmu mati kampret wkwk
negatif,mahal hasil harga mahal power plant produksi
netral,urus ekonomi orang warga daerah mending camat bupati
positif,prabowo sandiaga presiden wakil presiden gaji kaum dhuafa gaji gabung bulan sedekah juta bulan miliar tahun dhuafa bantu
negatif,jokowi kuliah ajar ekonomi pernyungsepan terap presiden bukti nyungsepnya
netral,ekonomi merdeka baik rakyat sejahtera
negatif,tampang anggur mental ogah orang dungu kaya gampang bodohin dijanjiin hidup senang prabowo menang harga mati wowo menang hidup enak ngimpi
positif,pdip karisma sendiri lindung ayom tegak adil berantas korupsi utama penting memjunjung idiologi pancasila nkri harga mati bangun demokrasi rata adil adil dukung sepenuh jokowi amin
netral,prabowo naik ratio jokowi ekonomi shock
positif,gaji prabowo sandi ambil peser bukti beliau juang penting rakyat bangsa ada
positif,kalimat tutup luarbiasa prabowo sandi menang pilih presiden wakil presiden ambil gaji syaa allah
negatif,beda uang awam gaji makan anak istri syahwat kuasa itu
netral,tumbuh ekonomi indonesia pimpin jokowi prabowo sandiuno
netral,prabowo bicara bangsa tekan cinta bumi bangsa negara sandi fokus ekonomi muara tanah arti tunggal
netral,daftarpresidenamerikaserikat bilah kasih amanat kali tingkat kebaji laut tampa tumbuh ekonomi depan
negatif,tema debat malam ekonomi paslon lenceng nanyain rakyat butuh main game main game gratis prabowo sandiuno
netral,ribu beli agen langsung ribu ribu agen konsumen orang jual ya untung namane putar roda ekonomi
negatif,jelek bong harga yapi hujat beda pklihan moga lapar suruh presiden makan mobile legend
positif,tarik program jokowi trans sumatera ekonomi kembang
positif,daftarpresidenamerikaserikat jokowi bangun spbu setelag kabupaten puncak jaya papua harga ribu liter
negatif,sudi ambil jokowi kapok pilih harap janji janji sesuai omong realitanya bikin kacau balau ekonomi adab dalamnegeri sepakat prabowo sandi ubah hilang kedholiman ketidakadilan
positif,prabowo ekonomi indonesia cacat arah makro salah dampak mikro rasa dampak emak awam kelas tengah bawah anggap dukung pikir akal argumentasi jelas
positif,angkat tema esport game mobile legends jokowi potensi suara kalang gamers potensi ekonomi dalam kalah
negatif,pilih usaha tingkat ekonomi pondasi ekonomi bangsa carut marut arah bijak rakyat untung kapitalis
negatif,ngapain holdang holding pakai istilah world class duit parkir negeri pengaruh ekonomi nasional
positif,prabowo bang sandiuno niat ambil gaji pilih nyinyir betulbetul nararongol tunjang gede sedekah dipamerin kampanye bawa agama amal terima pamer gusti gin hatred
positif,atlet indonesia prestasi pikir perintah harga jamin atlet prestasi jokowi hebat indonesia maju
negatif,pokok prabowo hancur ekonomi salah jokowi presiden
netral,prabowo ekonomi salah arah salah presiden presiden jokowi metrobali
positif,kasih jokowi bangun spbu setelag kabupaten puncak jaya papua harga ribu liter liter
negatif,bloon jebak ekonomi digital mobile legend alhamdullilah prabowo jebak
netral,bolak singgung deindustrialisasi salah jokowi kondisi salah arah bangun ekonomi lepas andil presiden
netral,anteng sandiaga tanah suci prabowo laku berita ekonomi
negatif,bayar pajak dipikirin jokowi
netral,nawacita jokowi nilai sukuses wujud mandiri ekonomi gerak sektor strategis domestik tingkat produktivitas rakyat daya saing pasar internasional indonesia maju
positif,terima gaji presiden wapres sumbang negara fakir miskin sejarah bangsa indonesia debat pilpres nyata tutup prabowo sandiaga youtube
netral,prabowo sandi ambil gaji pilih pilpres
positif,wowo salah arah ekonomi akibat deindustrialisasi salah presiden jokowi ekonomi indonesia jokowi ngehoaks salah presiden
netral,jaman harga pupuk murah jaman pupuk mahal langka
negatif,merdeka inflasi ekonomi bahan dimurahin
positif,perintah jokowi laju naik harga banding jaga tambah sejahtera rakyat
netral,jokowi serang sandiaga ekonomi makro alas keluh
netral,ya ekonomi digital infrastruktur digital kejar bas triliun investasi tegak daulat data datang ratus triliun investasi infrastruktur digital tahun researched
netral,syok ekonomi ratio kilat prabowo keliru
netral,nyata prabowo subianto debat capres malam tangan ekonomi salah presiden jadi bumerang jokowi
positif,infrstruktur sukses sluruh daerah rasa adil sejahtera ekonomi bagus aman kaku dana desa sindikat curi ikan tiarap amnesti pajak hasil prestasi jokowi lanjut
negatif,parah malaysia bayang bendahidup beetumpu warga negara kritik marah liat badaneksekutif swperti gaji uang
negatif,suara adil suara kpuid kerja makan gaji buta curang
positif,singapore yurop asal from indonesia responnya langsung oohhh jokowi kenal harga
positif,bagus harga jokowi
negatif,prabowo bilang hancur ekonomi gara pimpin ya hitung proporsional pimpin kuasa ya orde order mimpin sehat bambanggg
positif,ekonomi makro jadi alas tumbuh ekonomi rendah ya ekonomi makro jokowi gagal kelola ekonomi makro ya ganti
positif,prabowo tanggung ulang salah jokowi berani stategi ekonomi arah puluh
positif,terimakasih prabowo subianto bang sandiaga salahuddin gaji ambil penting masyarakat indonesia terimakasih terimakasih rakyat indonesia presiden indonesia adil makmur sabang merauke
positif,ekonomi tumbuh pimpin jokowi
negatif,hahaha coba lihat jokowi gagap digembar gembor bicara makro ekonomi selaras mikro fokus sdhlah ngaku alam tata kelola ada bikin utang bengkak lipat perintah normatif orang
positif,lapar perintah jamin harga bahan baku dippasaran
positif,lapar perintah jamin harga bahan baku dippasaran
positif,jokowi lembaga ekonomi perintah sektor maritim nelayan dukung mutlak bank mikro tuan asal negara april coblos
positif,bukti tulus ada terima gaji hasil kerja terima cupar indonesia serah perintah jokowi biar depan international
netral,simpul kembang ekonomi agraria maritim fokus primer peduli esport utama hal jokowi nomor satu infrastruktur
negatif,prabowo sandi sepakat ekonomi indonesia salah arah kedaipenacom
negatif,harga tiket pesawat turun brharap aspek trlbh dngan mahal harga tiket pswt terbang mahal tarif biaya expdisi kota lonjak
netral,kecewa demokrat prabowo harga kontribusi
netral,langsung benteng oposisi bang presiden jokowi dalm pemerintahanya bijak ambil pihak rakyat harga
netral,khmarufamin indonesia maju tumbuh ekonomi perata zaman jokowi tumbuh ekonomi perata bangun
positif,presiden jokowi kunker keliling indonesia buku sembako sepeda dana taktis presiden nila presiden gembar gembor sumbang gaji sumbang nilai gaji
negatif,basicnya buat behandel ekonomi makro jabawan jokowi kesal
netral,prabowo sandi janji ambil gaji pilih
positif,pilih coblos prabowo sandiuno infaq gaji prabowosandi infaqkan kaum dhuafa anak anakyatim indonesia
negatif,ngajarain ekonomi prabowo sandi kenyang ilmu puluh mesem moment satire faisalbasri mengigil liat
positif,pimp soeharto main bahan pokok murah listrik murah duit hutang jokowi kurang subsidi bangun infrastruktur pemb dampak ekonomi
negatif,contoh ekonomi china sujud
positif,please them that prabowo sandi ambil gaji presiden wapres gaji sumbang kaum dhuafa kerennn bukti beliau wakaf harta jiwa nkri
netral,prabowo lanjut kerja ekonomi arab saudi
netral,ekonomi indonesia salah jokowi kali alas
positif,dorong ekonomi kreatif digital masyarakat booming jokowi bicara dorong pikir kaku pandang benteng tentang mohon maaf buka
negatif,nasehat ekonomi ngefans jokowi prabowo salah daftarpresidenamerikaserikat ekonomi negara
positif,kritik prabowo harga pimpin dahulu
positif,pikir batas micro pikir macro anjak macro jual saham habis saham sandi kelas micro tanding ilmu ekonomi jokowi
positif,tumbuh ekonomi perata kala jokowi lembaga
positif,aktor mobile legend pubg indonesia dukung penuh jokowi daftarpresidenamerikaserikat sport peduli nasib mudah mudah harga diamond murah jangkau
positif,bukti ikhlas abdi rakyat bangsa ada rela kati batin raga harta pikir pamrih jgnkan terima gaji presiden wapres masyaaallah ketua tunggu salam insyaaallah berkah amenamon prabowo sandiuno
netral,watch nyata tutup prabowo sandi komitmen ambil gaji amanah youtube
negatif,ikut komunis sistem ekonomi komunis
netral,arsul sebut jokowi kejut papar ekonomi sekjen detail kejut gantung debat
positif,bentar narasi bangun lari bahas ekonomi temennya ayo ajar konsisten tema singgung wkwkwkwk
negatif,kocak ekonomi deindustrialisasi prabowo mngtkn mrpkn salah khusus sebut presiden jokowi bocahsosmed sukangetweet saaebunglon
negatif,modern prabowo zaman tritura goreng turun harga
positif,prabowo sandi menang otomatis sedekah kaum farkir miskin dhuafa gaji berfua ambil sedekah
netral,harga sikap bang langsung unfol mslah aneh bang bikin tweet mention brsangkutan tuju kontraproduktif langsung diunfol
positif,pilih prabowo sandiaga janji ambil gaji tetangga belah mantul bang
netral,menang pilpres prabowo sandi janji ambil gaji
negatif,maaf penuh janji tumbuh ekonomi indonesia pakai ngeles alas terimakasih
negatif,jelma donald trump omong kosong terima gaji
negatif,uang hutang listrik subsidi bahan bakar bantu pangan gaji naik gada nunggu prabowo presiden jawab gelar profesor mana
positif,program jokowi rakyat karto sembako beli harga murah tingkat sejahtera keluarga
negatif,detikcom jokowi lahh games beli mobil mewah beli rumah dapat harga kasih makan orang rumah bilang bobot hidup jaman soeharto orbaaaa hiduppp cendana
netral,jokowi bahas ekonomi makro mikro ya gizi hari sandiaga fatal keluar spot jenis ronta futuristik otak antik
positif,buset gaji gadiambil prabowo sandi
