sentimen,tweet
negatif,prabowo gaji ambil sumbangin jokowi kampanye nebeng pasilitas duit awam wkwkwkw mobil dinas pakai kaos ampe penuh luber kasihan mobil duuh
positif,prabowo sandi komitmen ambil gaji kepala negara pilih pilpres
netral,gesuriid perintah jokowi perata ekonomi
netral,langkah perintah daftarpresidenamerikaserikat jokowi daya ekonomi umat bank wakaf mikro tum arus muslimah merdeka munifah syanwani
negatif,anak suruh main calon kerja kasih kartu anggur kasih gaji kasih kerja mantull
positif,asiknya jokowi kerja nilai nilai sudut pandang serah nilai sudut pandang harga pilih orang diskriminasi pilih orang
netral,prabowo sandi usaha gaji gaji
positif,moga trans sumatra ekonomi indonesia lancar maju
negatif,scope pikir jokowi tekan main gamenya ekosistem main dota pubg bas indo tanggap prabowo potensi ekonomi kreatif
netral,jokowi mohmahfudmd sbyudhoyono setkabgoid salam bangsa nkri pancasila harga mati sabang maroke bendahidup politik tonton dapat demokrasi pilih presiden ngsung rakyat
negatif,balada kisah mobile legend makmur rakyat prabowo digital bagus rakyat butuh swasembada pangan pangan harga jangkau kembang mobile legend gokill
negatif,tilil capres presiden ngomongnya game khayal pantes tumbuh ekonomi menghayal
netral,video kaku pandang beda jokowi prabowo bahas real energi sosial lingkung ekonomi politik budaya batubara
negatif,jokowi waris ekonomi bobrok lumayan
negatif,orang pikir perut kesejatraan bangsa bicara mobil lagend main anak milenial rumah beras tani gagal panen harga mahal bicara mobil lagend
negatif,prabowo sandi ambil gaji pilih presiden wakil presiden alokasi gaji kaum dhuafa yatim piatu penting indonesia dengar statement tertawa
netral,jokowi fokus unicorn mobile legend dampak buruk generasi muda prabowo fokus ekonomi ecomerece meperburuk ekonomi putus mata rantai distribusi orang
negatif,gin bahwasanya biar prabowo mikir rakyat ekonomi mikro aman sandi teknologi didik kasihan dibebanin joko maruf bicara debat ngos ngosan suruh kerja
positif,ayo dukung prabowo biar negara keluar prabowo menang gaji tunggu janji pilih janji realisasi orang
positif,gaji jiwa raga serah rakyat indonesiaa kalimat gusdur bendahidup ikhlas indonesia prabowo
netral,bumn benteng ekonomi negara
netral,ardy merespon nyata lontar capres debat kondisi ekonomi indonesia nila salah bowo aku salah jokowi salah salah presiden jokowi
negatif,codot harga ribu murah harga bayar kampanye prabowo enggan
netral,tutup debat pamungkas prabowo sandi mandat seperserpun gaji ambil
netral,indonesia negara ekonomi kuat empat dunia langkah hadap rintang jokowi gelora karno jakarta sabtu
netral,maaf pakai subsidi pakai ygkg harga tera nomor wajib tempel dinding toko biar masyarakat mangkanya harga brubah ubah jokowi subsidi alih
negatif,skak prabowo sandiuno halal rebut kuas rengek rengek kuas dalih ambil gaji ambil tunjang ayaniulva iwanpiliang musniumar hnurwahid sayapgaruda rizalkuddah
positif,great closing statement from next indonesian leaders prabowo sandiuno komitmen dua ambil gaji rupiah percaya
negatif,kartu tawar jokowi rakyat nasib karyawan gaji atas anggap masyarakat aids mastautin produktif sandiuno dahnilanzar fahrihamzah
netral,jokowi perintah keras dukung ekonomi digital pokok dukung ekonomi digital
netral,gaji terima insentif giat jokowi klarifikasi sistem uji lhkpn laku
netral,mantulz penuh tenang umroh cinta bini anak ahirnya dalamnegeri asset pulang harga sehat pakdeee
positif,mari harga raya ramai demokrasi penuh suka cita prabowo larang ya alhamdulillah jokowi kalah
positif,bahas jokowi tumbuh ekonomi timpang perhati
positif,hmmm paslon bahas ekonomi makro global paslon anak bayi ngerti lihat ajar paham nyata mantap pilih jokowi
netral,jokowi sport mobile legends prabowo sandi turun harga rakyat susah tribun timur
netral,game bagus ekonomi bagus kejiawaan
netral,debat buka sandi nilai kuasa ekonomi jokowi paksa bicara digital
negatif,tanding kalah gubernur indonesia anies wina lompat pakar ekonomi kelola uang harga ekonomi masy tingkat aja suruh ikat pinggang kencang sabar sorry biasa jalan kenal sensi
negatif,paham tata negara paham atur paham bijak ekonomi paham kursi tri isi orang kompeten ketimbang prabowo jatah kursi menteri parpol dukung
positif,jokowi baik ekonomi indonesia raya sandi gelut beda kelas bangaatt
netral,ekonomi indonesia salah jokowi kali nyata
positif,negara pimpin bendahidup ahli strategi lindung militer sanding ekonomi insya allah hasil ada daulat adil makmur
positif,jujur tuju gimana ya debat kemarin debat capres tonton turut jokowi ngomongnya ngerti teori ekonomi mikro makro tangan bangga
negatif,jokowi ekonomi digital wadooo
netral,prabowo sandi kuasa solusi nkri harga akhir anak cucu
positif,gaes jokowi bangun spbu setelag kabupaten puncak jaya papua harga ribu liter
negatif,teori mabok prabowo sandi pangan murah tani makmur murah harga beli tani murah tani makmur makmur gerombol bohong
positif,nampaknya sandiuno ditungguin jokowi tipe debat sebut contoh ekonomi nama debat sandi layang bola langsung smesh jokowi game over skak matt mantul
negatif,haduh prabowo debat kaga nyambung sebut salah arah ekonomi salah presiden presiden jokowi
negatif,tolong beda startup monetizing hobi monetize startup nilai ekonomi hobi gelintir orang laku butuh ya allah beda lebar
netral,harga harga motor mahal jokowi
negatif,horang banyak bebas ya prabowo sandiuno butuh gaji beranganangan lahan benteng ganti
netral,kait ekonomi makro jokowi beka ayo besok data lihat
negatif,bebasin pajak kendara capres naikin ratio pajak korban nutupin bebas pajak kendara
negatif,rakyat sulit ekonomi dongok mobile legend prabowo mengembalikannnya konteks waras pertanyaa salah njing
negatif,prabowo ikut karyawannya ambil gaji
positif,ketua harga partai kerja jokowi nikmat hasil maslahat ummat garis juang ketua pihak masyarakat lemah jokowi bantu masyarakat desa
negatif,mmrintahkan personil pangkat rendah membuly gatot azab polisi alat muas nafsu politik jokowi gaji jabatn
negatif,milenial paham potensi bisnis dunia digitalisasi ekonomi kreatif industri nothing perintah jokowi infrastruktur arah
negatif,nyata prabowo sandiuno ambil gaji berita
positif,sehat pangkal harga tentu fkir bodoh semenjak jokowi subsidi kurang alih bantu bolak orang bijak mbolak
positif,pancasila harga mati bravo presiden jokowi
positif,wajar jokowi iriana berkat istri pungam beliau fokus baik ekonomi salah arah puluh prabowo hasil nyata
negatif,suara adil merdeka suara kpuid kerja gizi gaji buta curang
negatif,ada ngutang bangun infrastruktur pakai masyarakat masyarakat keluh negara budi bayar hasil ya pajak
netral,presiden jokowi beraja salman sepakat tingkat kerjasama ekonomi apahabar
netral,jokowi capai maju syukur indonesia tumbuh kondisi ekonomi global gejolak
positif,harga dahulu doa terus best president ever karno harto habibie gusdur mega jokowi prabowo
positif,tuju nalfah jujur kagum ilmu harga pilih beliau hak masuk surga beda ya beliau jamin langsung masuk surga gimana
negatif,ucap nyata bowo salah orientasi ekonomi negeri presiden jokowi sungguh luka sendiri demokrat
negatif,jokowi bunuh orang nyulik ngemplang gaji karyawan masuk panama pappers gampar ipar tinggal bini setir adik bicara ya tambah wkwkwk
negatif,judul fitnah kaset pilpres prabowo utang prabowo culik prabowo langgar prabowo kasih gajih hahaha basi cong basi percaya berita ini gelintir pendkung
positif,bagi dijawa beda mgkin parah timur rasa jogja harga stabil sedia kurang yaaa lembaga ke akal
negatif,harap prabowo paham harga gabung hubung sepakat jadi cawapres ingkar awam kawan politik faedah
netral,prabowo markah ekonomi salah arah presiden jokowi batlaxcom
negatif,jokowi capres papar uang investasi bahaya malar akibat shock ekonomi
positif,sodaqoh ikhlas pilih prabowo sandiuno gaji pakai santun anak yatim faqir miskin sodaqoh vote nila sodaqoh
positif,teman sejati amal bilang pilih prabowo sandi amal gaji beliau amal
netral,prabowo subianto sandiaga gaji gaji daftarpresidenamerikaserikat
negatif,gaji peser ambil ambil modal bayar hutang prabowo ya keuntungam sekian wooooii lelembut rakyat indonesia bodoh dukung juta umat
negatif,awam butuh fundamental ekonomi pangan anduh papan digital model mobile legend timeout citra
netral,bangga jalan ekonomi jatuh nengara menag buka jala megah aksi bumi laut limpah ruah idonesia depan menang
positif,pilpres pilih prabowo alas piara kucing peduli alas ekonomi kesejahreraan unicorn agama jokowi merdeka iya nyoblos
netral,jokowi kritik tumbuh ekonomi pamer akuisisi freeport
positif,ayo smart bantu koreksi baik jalan olok olok infrastruktur pada depan industrialisasi cipta indo ekonomi indonesia pesat dampak indonesia jokowi
netral,prabowo sandi tumbuh ekonomi pangan maju daulat kancah international antar indonesia adil makmur
negatif,anjing harga kalia projo rela nyuri maling ramai jokowi instruksi menghalalka
negatif,mahal hasil harga power plant produksi
positif,ekonomi masyarakat bagus jajan warung jajan restoran mall ramai jaman modern jajan warung ribu mall pakai gopay ribu nikmat salah presiden salah laku usaha
positif,menteri prestasi pimpin jokowi mana menteri raih harga
negatif,percya gaji prabowo sandiuno dsumbangkan presiden bearti orang dungu
netral,jokowi ekonomi indonesia
negatif,nyerocos profesor sumitro joyohadikusumo ekonomi benteng orde orde karier militer prabowo beliau menantu harto macam tetangga kamar kaget bilang sumitro turun tionghoa muslim
negatif,nama wowo tuding balik salah ekonomi indonesia jokowi teguh dengerlah
positif,alhamdulillah capres sedekah gaji rakyat miskin korban gempa pasigala butuh bantu prabowo sandiuno karniilyas rockygerung
negatif,selesai hidup bisa harga mahal turun solusi benteng prabowo bahlull
negatif,prabowo bangun ekonomi cacat arah sistem ekonomi mudah mudah tutup ya chavez cerita hebat venezuela derita
netral,harta harga keluarga jokowi
negatif,jelek bong harga yapi sumpah beda pklihan amat lapar suruh presiden makan mobile legend
positif,prabowo harga pangan murah sesal pilih
positif,indah venue gandeng tangan harga sepuh sayang maju sedih tiang sepuh begitu
positif,berani ganti bidang ekonomi hukum srek mohmahfudmd cawapres kurang cepat perintah optimis jokowi
netral,menang pilpres prabowo subianto sandi janji ambil gaji
negatif,pantesnya benteng sono mastautin indonesia beda mending bicara ekonomi makro perata sama amenamon periode
positif,great closing statement from next indonesian leaders prabowo sandiuno komitmen dua ambil gaji rupiah
positif,terimakasih prabowo subianto bang sandiaga salahuddin gaji ambil penting masyarakat indonesia rakyat presiden indonesia adil makmur sabang merauke
netral,dewi dedi andal perata ekonomi jokowi depan
positif,niat tulus rawan daerah menang jokowi amin jadi moment tragedi harga bangsa negara
negatif,manusia per ngerti mobile legend bicara langit sangka jalan langit akum sampah bicara paham ati main gaji buzer ya ngerti bahasa
negatif,bicara pajak naik pajak serba pajak pajak bayar sok naikin pajak sehat prabowo
positif,mantap pilih jokowi bilang debat ekonomi indonesia salah cacat pimpin gemar salah ya bos
positif,debat jokowi kuasa jalan mana beliau tegas lawa ekonomi makro mikro
positif,dukung jokowi umur hidup presiden turun pilih gamers berantas anggur indonesia kerja tidur pegang gaji
positif,faedah negara bidang kerja bagus gaji gede happy duit hati akal buka invest eksploit padat karya buka sedekah kaum marjinal selamat juang
positif,wowo keliru arah ekonomi datang deindustrialisasi cacat presiden jokowi indonesia ngehoaks beban
positif,alhamdulillah bang sandi moga ke negeri prabowo dukung bijak baik ekonomi merdeka puruk salam agung anfaunnas surabaya
positif,betulbetul wowo apresiasi ekonomi negara bawah pimpin pakde jokowi terima kasih
positif,tuju macro ekonomi jokowi jago rancang tulis ahli ahli rancang bangun indonesia ya jokowi paham
netral,rizal ramli ekonomi indonesia tumbuh persen prabowo pilih
positif,akutuh kasihan ngelihat jokowi umur trsnyum saat orang ngebenci luar capres ngehargai usaha bapa presiden bapa orang kuat tabah sabar hina rakyat kadang suka nang ngeliat bapa
negatif,fokus begitu fokus harga sembako tani bilang kasar ngapain ngurusin games bahas bang sandi awal nyimak kali coba puter video
netral,pilih prabowo sandi ambil gaji yatim kaum
netral,mudzakir guru ngaji jokowi anak bendahidup dewasa ajar baca quran privat
negatif,aneh bingung letjen pecat umur militer menteri kali ekonomi salah arah tanya salah arah mana solusi ngawur
netral,bumn kuat benteng ekonomi tusuk prabowo sandi
netral,prabowo ekonomi indonesia jokowi salah arah
positif,coblos prabowo bang sandi aids amal beliau gajinnya kaum dhuafa anak yatim hasil
netral,gasah ejek program jokowi pikir masak mari harga hujat
positif,adil makmur korupsi ambil gaji prabowo sandiuno
positif,mbak ekonomi topik jokowi ekonomi makro bahas derivatif tiga laju inflasi uang dar rakyat beli mikirnya sandang pangan papan indonesia maju
positif,industri apa topang ekonomi bengkalai saing infrastruktur tinggal adaa prioritas bangun tahap hasil
netral,gaes menteri prestasi pimpin jokowi mana menteri raih harga
netral,berita baru naik rasio pajak prabowo kenang orde
positif,maju sumatra moga jalan tumbuh ekonomi banyakkkkk aamiinn
positif,gaji prabowo subianto sandiaga salahuddin ambil daftarpresidenamerikaserikat sumbang awam bang kembali
positif,daftarpresidenamerikaserikat jokowi kunker keliling indonesia buku sembako sepeda dana taktis presiden nila gembar merdeka gembor sumbang gaji aids nilai
negatif,keluh ekonomi deindustrialisasi jokowi wowo hobi nyalahin orang
negatif,prabowo sandiuno harga murah jangkau rakyat bijak sosialis apa venezuela ekonomi venezuela collapse inflasi populis seram efek
netral,dibukuny konsep prabowo impor utang adab joran tingkat rasio pajak tutup kran bocor apbn industrialisasi meningkatkn gaji tegak hukum kurang korupsi kuat
positif,jujur aku beda ekonomi makro mikro sekua bendahidup debat salah sandiaga sanggah jokowi diam mudeng
positif,jokowi bangun revitalisasi pasar merdeka rakyat dasar primer ekonomi bas rakyat dayausaha indonesia stabil
negatif,ya atletik ekonomi kreatif buka peluang bendahidup sempit
positif,capai hasil capai tumbuh ekonomi perintah jokowi tingkat
netral,paslon jokowi abah khmarufamin progam dewi desa wisata dedi desa digital mekaar bina ekonomi keluarga sejahtera contoh strategi daya ekonomi masyarakat desa
netral,daftarpresidenamerikaserikat wapres gaji prabowo sandi negara
positif,dukung jokowi enak nganggur gajih suruh main mobile legend
netral,assalamu alaikum suara harga upaya jaya prabowo sandiuno rela jakarta daerah moga serta balas amat allah kabul amenamon bahwasanya rabb
negatif,perintah rezim kuasa skarang salah prabowo memang gaji presiden prabowo ya
positif,dampak second round effect momen asi games efek ganda ekonomi sebab cipta area kerja tumbuh ekonomi tambah dapat masyarakat jokowi hebat
netral,salah hasil jokowi harga titik wilayah target titik wilayah indonesia
positif,debat tutup sandiuno prabowo komitemen ambil gaji rupiah amanah
positif,bismillah rabu april coblos prabowo sandi samahalnya amal gaji beliau sumbang dhuafa
negatif,prabowo harga rawan puasa tirakat munajad malam suntuk doa menang balas tweet bantu ngopi rokok tirakat mujahadah gagal ayo
netral,asosiasi usaha bumiputera nusantara indonesia asprindo anggota umkm dukung capres prabowo sandi program bebas pajak usaha untung prabowo sandiuno
netral,knks kemban jokowi tahan ekonomi jadi indonesia islamic finance dunia
negatif,bikin puisi ekonomi persen
negatif,iya sprtnya sehat raut wajah gubernur masak biarin anak gizi kerja citra mlulu bayar awam makan gaji buta
positif,allah terima kasih indonesia komitmen ambil gaji rupiah amanah sandiaga bukti tulus negara bangsa prabowo
netral,prabowo sandiaga janji ambil gaji presiden wapres
positif,ambil gaji catat saudara harta prabowo sandiuno penting rakyat lanjut negara cinta
negatif,ngapain holdang holding pakai istilah world class duit parkir negeri pengaruh ekonomi ekonomi nasional
positif,kompascom yaelaah jokowi nurunin harga butuh hitung cermat matang asal
netral,bahas prabowo salah salah sumberdaya ekonomi tanah udara frekwensi sesuai asli kelola negara luas rakyat
negatif,awam sulit ekonomi dongok mobile legend prabowo mengembalikannnya konteks waras pertanyaa cacat njing
negatif,bumn benteng ekonomi prabowo hancur holding beres garuda bangga morat marit
negatif,jokowi waris ekonomi bobrok merdeka lumayan
negatif,gaji ambil tunjang ambil walah
netral,capai hasil capai tumbuh ekonomi perintah jokowi tingkat
negatif,ngajarin ekonomi mikro makro usaha kaya prabowo bang sandi ngajarin ikan renang jago
netral,ekonomi tumbuh hukum adil
positif,prabowo sandi mafhum ekonomi negeri solusi mantao
positif,asas ekonomi perata bangun gratis bangun hutang bayar pajak rakyat jaga percaya pilih menghianati demokrasi sehat presiden
netral,bantu maju ekonomi bangsa jokowi
netral,komitmen prabowo sandi ambil gaji pilih presiden jumpa ikhlas adab kaya
negatif,harga periode jokowi jabat pikirin
netral,prabowo garuda sulit untung kuasa harga avtur
negatif,they expect that template debat asai asing naik rasio pajak harga mahal prabowo sandi
positif,komitmen prabowo sandi gaji kaum dhuafa alhamdulillah subhanallah sejarah presiden wapres indonesia gunromli dennysiregar permadiaktivis
positif,dukung jokowi enak nganggur gajih suruh main mobile legend
positif,hormat harga apresiasi pilih ulil moga labuh ulil abshar abdalla kubu jokowi amin insa allah tarik gerbong milenial ragu bimbang tentu pilih amin
netral,sandi tusuk prabowo sandi ambil gaji rupiah dunia kepala negara gaji prabowo sandi asia tenggara
netral,harga harga butuh pokok jangkau kendali
netral,peluang bisnis dampak antisipasi hadap ubah salah perintah keluh pimpin negara arus ekonomi bisnis global hindar braay khawatir pangan
netral,presiden jokowi gelar temu raja salman bahas kerja ekonomi
negatif,bajing tengik sembah lengser jokowi orang dableg fokus ekonomi tahan indonesia mobile legend
negatif,ucap nyata bowo salah orientasi ekonomi adab presiden jokowi cuma luka asing demokrat
positif,prabowo sandi pilih ambil gaji tanda kerja rakyat
positif,nasionalisme beliau dunia internasional milu kunjung solusi kerja kembang ekonomi indonesia mantab jokowidodo lanjut
negatif,ulang beda ekonomi mikro ekonomi makro
positif,asa jaman londo tani ya mandiri dech rasa parit sawah dirapiin irigasi lumayan bantu benih padi traktor mahal poll beli ya sayang harga jtan kerja
negatif,wkwkwkk tukar gaji habis indonesia
positif,lega anugerah bukti jokowi sosok ketua aku integritas
negatif,paham ilmu ekonomi variabel maju alim mingkem merdeka jancuk
positif,pimpin karismatik prabowo sandiuno ambil gaji presiden wakil allah subhanahu
negatif,gaji presiden prabowo uang segitu beli kuda ekor wapres kisar yaelahhh jajan minggu anak sandi kali
netral,video janji merdeka prabowo sandi ambil gaji menang
positif,lantik prabowo sandi macan asia ketua asia gaji
negatif,mesti belengket kesana orang muka cling fasionable happy bendahidup susah ekonomi sederhana bahagia bangga bayar cebong makmur lahir bathin
netral,menang pilpres prabowo sandi komitmen ambil gaji walapun rupiah
negatif,sidimpuan male ham lapar beras mahal harga getah kampung ribu harus gizi gadung alias
netral,harga skincare turun tusuk prabowo sandi muka uban glowing camuk guerlain orchide imperiale
netral,demokrat prabowo inti orba rusak indonesia tanggap nyata prabowo salah presiden jokowi ekonomi indonesia nyata ujung walk petinggi demokrat
netral,nama jaman modern gaji ya transfer ambil pilih prabowo sandi ambil gaji
positif,gusdur dukung prabowo fatwah gusdur prabowo presiden paking ikhlas insya allah terbikti beliau kalah kali beliau ikhlas melanjutkn juang malam dengar sandiuno terima gaji
negatif,adegan iconik debat prabowo ekonomi puruk elite kuasa nikmat kaya bangsa kyai prabowo ya oalah prabowo bicara hehehe
positif,bentar narasi bangun lari bahas ekonomi temennya ayo ajar konsisten tema singgung wkwkwkwk
netral,wowo jokowi salah salah bikin arah ekonomi salah
negatif,prabowo contoh ada china dukung goreng anti aseng sandiwarauno pandang ekonomi makro siska cicih dedeh stresss emma
negatif,prabowo bilang hancur ekonomi salah jokowi salah presiden wajah agusyudhoyono langsung kecut
positif,mantan mertua bela mbak biasa derita prabowo bahwasanya penting dayaupaya legacy daftarpresidenamerikaserikat persepsi harga
negatif,prabowo terima gaji exit plan karyawan kiani kertas terima kaji rakyat karyawannya gaji munafikun
positif,pilih prabowo sandi bersodaqoh gaji prabowo sandi sedekah fakir miskin mantap sebar jackvardan
netral,bolak singgung deindustrialisasi salah jokowi kondisi salah arah bangun ekonomi lepas andil presiden jokowi
negatif,jokowi paham ekonomi makro mikro romlah
positif,gaji prabowo sandiuno kasih fakir miskin keren
positif,masyaallah hati mulia pilih presiden wakil dua ambil gaji rupiah duafa negara prabowo sandi kaku pilih
netral,alas capres prabowo bhwa keliru ekonomi indonesia salah bakal presiden tahana jokowi bendahidup kejut
netral,prabowo bijak ekonomi salah presiden objektif
netral,ketemu ya nomor whatsapp bayur bekas tani bayur harga fluktuatif normal kisar kilo gabah kering
negatif,nasehat ekonomi ngefans jokowi prabowo salah presiden jokowi ekonomi negara
negatif,prabowo bilang indonesia bubar tumbuh ekonomi ndasmu tanggap thearieair theopieter fadjroel
positif,sandi prabowo bisnis gaji presiden ambil bisnis fanatik fitnah orang percaya search google harta
negatif,prabowo sandi imitasi trump pence orientasi garis visi misi idealisme komitmen terima gaji presiden wapres said wealthiest candidate well going think
positif,merdeka hatihati prabowo sandi komitmen oleh gaji rupiah heheheheheh
negatif,gaji fasilitas tunjang siape
positif,masyaaallah kali umur kandidat capres cawapres janji rakyat indonesia ambil gaji serah negara subhanallah getar hati rakyat indonesia
positif,awam butuh pasti harga jangkau cari kerja gampang kad kartu prabowo sandi solusi bangsa
netral,prabowo garuda sulit untung pengaruh harga avtur
positif,prabowo sandi paslon papar pandang misi awam hubung nyapun harmonis seorangdiri sumbang gaji maklum tajir
negatif,mgkin tipe orang dokrin hasil uang kerja makan gaji aku pola pikir mayoritas babu asing
negatif,janji maju ekonomi bangkit kata henti import stop utang bahwasanya lambai tangan biar prabowo sandiuno banyak ngeles
positif,kritik prabowo harga ketua dahulu
negatif,jebak kapabilitas jokowi ekor lepas kaki ikat trlihat bijak ekonomi makro cacat fokus cari budi bayar angsur akhir parlente munculah mobile legend support bappenasri bpkpgoid
negatif,ngajarin prabowo sandi ekonomi makro pintar plonga plongonya laut garam tuman
negatif,prabowo bilang presiden ngapain mbak polos pertmbuhan ekonomi roket hebat
netral,bumn benteng ekonomi negara
netral,prabowo sandi serah gaji anak yatim kaum duafa amin
negatif,lembaga ekonomi perata waduuuh timpang jokowi khmarufamin pikir kesini
netral,presiden jokowi raja salman sepakat tingkat kerja ekonomi bal netizen
positif,digital ekonomi papar cawapres laku perintah jokowi solusi tawar paslon jalan debat final mala
netral,prabowo sandi wakaf gaji presiden wakil presiden
negatif,strategi cebong gampang riak orang hoax bilang orang pesimis prabowo sandi optimis ngeles ekonomi makro zaman ekonomi makro ya listrik murah harga sembako murah bangun
positif,mudah cahaya lihat laut manusia hari tepat tanggal april pintar cinta damai provokator muda percaya hoax dukung jokowi golput pancasila toleransi nkri harga mati
negatif,bikin puisi ekonomi persen
netral,harga kupon pesawat urung niat orang coblos mana daftar pilih suara hilang beli tiket jalan darat jokowi budikaryas kemenhub
negatif,pakai susu produksi usah nepotisme ambil gaji proyek asai saudara orba bangsat tipu culik bunuh
negatif,gaji peser ambil ambil simulasi bayar hutang prabowo bahwasanya keuntungam sekian wooooii lelembut rakyat indonesia bodoh dukung juta kalang
positif,prabowo sandiuno mandat rakyat ambil gaji jiplak dennysiregar
netral,coba ulang debat jokowi pandang prabowo kembang ekonomi digital ya esport bilang prioritas
positif,jokowi beda ragam kebhinekaan indonesia jaga rawat dasar negara pancasila nkri bhinneka tunggal final harga mati ganggu gugat
positif,moga contoh ustadz abdul shomad undang istana benteng apa prabowo sandi daftarpresidenamerikaserikat ambil gaji muncul orang ikhlas juang indonesia adil makmur
positif,harga pangan turun harga tani nelayan ternak bangkrut biaya produksi harga jual ayo tani ternak nelayan pilih jokowi amin harga stabil jangkau real price
positif,pdip karisma asing lindung ayom tegak adil berantas korupsi lebih penting memjunjung idiologi pancasila nkri harga mati bangun demokrasi rata adil adil dukung sepenuh jokowi amin
negatif,terima pajak bahasa keren ratio ratio sumber terima pajak tambah sumber tarif contoh cukong konglomerat bayar pajak paksa bayar bilang kontradiksi tau paham
netral,biofuel ekonomi makro mikro gampang jokowi
netral,bantu maju ekonomi bangsa jokowi
positif,ngemplang pajak korupsi main proyek mafia impor meriang takut prabowo menang
negatif,malam omong ekonomi prabowo sandi senyum simpul tanda
negatif,nama wowo salah bowo bangun ekonomi indonesia salah arah lepas andil presiden presiden jokowi jokowi tasyashee dengerlah wowo
positif,beda pimpin pecah makro rakyat alas keluh orang hasil tgupp gaji senang banjir macet
netral,debat tema ekonomi kebaji gaul fiskal investasi dagang industri merdeka wujud jokowi aku bangun infrastruktur pulau jawa
netral,sandiuno jokowi bangun bendung sawah tali tingkat produk beras gagah kerja tahap bangun ekonomi nikmat rakyat enak tekapak tangan memang lampu aladin
